user_id,query,domain,description,engine,emails,phones,dateOfSearch
3,этикетка,https://ksen-ri.by,"Самоклеющиеся этикетки имеют широкую область применения и являются незаменимыми помощниками при маркировке корешков офисных папок, создании бейджей, вывесок или ...",google,"['druk@ksen-ri.by', 'info@ksen-ri.by', 'magazin@ksen-ri.by', 'shtamp@ksen-ri.by', 'zakaz@ksen-ri.by']","['+375172072347', '+375172174205', '+375172523553', '+375172703553', '+375173503553', '+375173970764', '+375173972257', '+375173977553', '+375291805350', '+375293355331', '+375295564360', '+375295622254', '+375296657553', '+375447171271']",2025-09-13T11:24:03.529122
3,этикетка,https://oblakoprint.by,"Выделите свой продукт с помощью круговых этикеток БОПП с высококачественной печатью от ""Облако Принт"".",google,['oblakoprint.by@gmail.com'],['+375445364717'],2025-09-13T11:24:03.529123
3,этикетка,https://upakovki.by,"Какой материал выбрать для подложки самоклеящейся этикетки? Дешевле обойдется бумажное основание. Используют глянцевую, полуглянцевую или матовую бумагу. Такой ...",google,['lebras@tut.by'],"['+375296426963', '+375296977375']",2025-09-13T11:24:03.529125
3,этикетка,https://unimark.by,"Этикетки для термотрансферной печати характеризуются повышенной устойчивостью к УФ-излучению, печать на них не выцветает и держится долго, хорошо крепится к ...",google,['info@unimark.by'],"['+375172504545', '+375295583030', '+375445583030']",2025-09-13T11:24:03.529126
3,этикетка,https://aenter.by,"PLT - Этикетки из полиэстра, поставляются в рулонах · Материал - самоклеящаяся полиэфирная пленка · Необходимые обозначения наносятся на термотрансферных ...",google,['info@partex.by'],"['+375172700842', '+375296824888']",2025-09-13T11:24:03.529127
3,этикетка,https://antarion.by,"Этикетки для крышки ведра (набор из 6 цветов) ... Цена за шт. 10.16 руб. шт. В корзинуВ корзине. Характеристики. ID, 91000167. Артикул, ETI RESINA6. Количество ...",google,['blum@antarion.by'],"['+375173200100', '+375293940100', '+375333640100']",2025-09-13T11:24:03.529129
3,этикетка,https://daliban.by,В нашем магазине вы можете купить этикет-ленту и термоэтикетку по оптовой цене с доставкой по Беларуси от прямого поставщика.,google,['info@daliban.by'],"['+375173882829', '+375173966206', '+375293966205', '+375293966206', '+375297076206']",2025-09-13T11:24:03.529131
3,этикетка,https://etiketka.com.by,Мы предлагаем · Чековая лента · Самоклеящаяся этикетка · Этикет-лента для маркировочных пистолетов · Этикет-пистолеты · Флексопечать печать на бумаге и пленке.,google,"['anna_vasilenko@ntsretail.by', 'ntspoligrafia@mail.ru']","['+375173171533', '+375232246244', '+375234065189', '+375296109157', '+375445359125', '+375447774014']",2025-09-13T11:24:03.529133
3,этикетка,https://www.pos.by,"У нас всегда в наличии этикетки самых разных размеров. Самоклеящиеся этикетки подходят для оборудования брендов: TSC, Gainscha, DBS, HPRT, GPrinter, Honeywell, ...",google,['info@pos.by'],"['+375172570303', '+375172579199', '+375173881616', '+375296013020', '+375298350295']",2025-09-13T11:24:03.529135
3,этикетка,https://druk-s.by,"Закажите печать этикеток под ключ: разработка макета, подбор материала и формы, постпечатная обработка, доставка до дверей. Быстро, качественно, в срок.",google,['info@druk-s.by'],"['+375172242224', '+375173177875', '+375291737877', '+375293346629', '+375296737582']",2025-09-13T11:24:03.529137
3,этикетка,https://vormatic.by,"Защитные антикражные этикетки — противокражные плоские наклейки небольших размеров, выполненные чаще всего в виде штрих-кода, наклеивающиеся на товар или ...",google,['sale@vormatic.ru'],['+79601183838'],2025-09-13T11:24:03.529140
3,этикетка,https://lsys.by,"Купить Светосигнальная арматура Eaton в Минске. Держатель этикеток Titan M22S-ST-X, h=50мм от официального дистрибъютера lsys.by.",google,['office@lsys.by'],"['+375172471999', '+375297871999', '+375445671999']",2025-09-13T11:24:03.529141
3,этикетка,https://shop-belblank.by,"В каталоге широкий выбор самоклеящейся бумаги, этикеток и ценников. ✓ для принтеров и копировальных аппаратов ✓ для этикет-пистолетов ✓ для маркировки ...",google,['buy@belblanc.by'],"['+375172151465', '+375173006722', '+375445550568']",2025-09-13T11:24:03.529142
3,этикетка,https://artery.by,"Этикетки самоклеящиеся, ценники можно выбрать и купить в нашем каталоге. Самый крупный склад канцелярских товаров в Гродненской области.",google,['office@artery.by'],"['+375152603317', '+375293663317', '+375333663317']",2025-09-13T11:24:03.529144
3,этикетка,https://www.aversys.by,Недорогие универсальные намотчики этикеток серии Labelmate MINI-CAT способны наматывать рулоны любых этикеток шириной до 115 мм со скоростью до 50 cм/сек.,google,['info@aversys.by'],"['+375173544415', '+375291114415', '+375291779900', '+73883764811', '+78573179143', '+79277179546', '+79976963695']",2025-09-13T11:24:03.529145
3,этикетка,https://spektrpress.by,"Этикетка для сыра ПАРМЕЗАН — это не просто наклейка, а настоящее произведение искусства, созданное с заботой о вашем продукте и его потребителях.",google,"['info@spektrgroup.by', 'rus@spektrgroup.by']","['+375152474747', '+375293433222', '+375333488222', '+79056962069']",2025-09-13T11:24:03.529147
3,этикетка,https://mertech.by,"Допустимая площадь этикеток для FBO равна 30×20 мм, 43×25 мм, 58×40 мм. Этикетки требуется наклеить не только на товары, но и на дополнительную упаковку.",google,['info@mertech.by'],"['+375293117776', '+375293807776']",2025-09-13T11:24:03.529149
3,этикетка,https://prodavan.by,"Они представляют собой рулоны или листы с этикетками, готовыми к нанесению на любую подходящую поверхность. В линейке ТЭКО ТТОР предлагаются различные размеры, ...",google,['info@prodavan.by'],"['+375255016878', '+375293117292']",2025-09-13T11:24:03.529150
3,этикетка,https://xn--b1aaeeabb0hpc6ae.xn--90ais,Терминал используется в товарных и промышленных весах с печатью этикеток и чеков. Подключается к модулям взвешивающим серий TB и 4D.,google,['sales@1vesovoy.by'],"['+375173880717', '+74997556597']",2025-09-13T11:24:03.529153
3,этикетка,https://kley-loctite.by,"Представляем вашему вниманию недорогой клей AQUENCE XP 200 (Optal XP 200) итальянского происхождения для этикетирования стеклянных бутылок, в том числе с ...",google,['promkleyservice@mail.ru'],"['+375172761032', '+375173566597', '+375296371072', '+375296371076']",2025-09-13T11:24:03.529155
3,цемент купить,https://igolenka.by,"Цемент купить в интернет-магазине Иголенька в Лиде по лучшей цене. Широкий ассортимент, рассрочка, скидки. Самовывоз, доставка по всей Беларуси.",google,['info@igolenka.by'],"['+24742475', '+375291144084', '+375291728949', '+375291887241', '+375295189190', '+375336862436', '+375336973330', '+375445220485', '+375445221159', '+375445458059']",2025-09-15T13:41:04.359284
3,цемент купить,https://www.postroyka.by,Купить цемент (портландцемент) в мешках 25 кг в Минске. ✴️Быстрая доставка по Минску. ✔️В наличии цемент Д0 и Д20 марки М500. ✴️Оптом и в розницу.,google,['mail@postroyka.by'],"['+375172151465', '+375172151740', '+375172152626', '+375173600118', '+375296115959', '+375296285959', '+375296585959', '+375296595959', '+375296795959', '+375296835959', '+375336115959', '+375336285959', '+375336585959', '+375336595959', '+375336795959', '+375336835959']",2025-09-15T13:41:04.359316
3,цемент купить,https://ksk.by,"Каталог цемент в интернет-магазине KSK. Большой ассортимент цемент с доставкой по Гомелю и регионам Беларуси. Наличный, безналичный расчет.",google,['info@ksk.by'],"['+375232241985', '+375232242466', '+375232347735', '+375445252694', '+375445252695', '+375445252696', '+375447462222']",2025-09-15T13:41:04.359320
3,цемент купить,https://mamont.by,"Купить цемент 25 кг М500. ⚡ В продаже цемент, портландцемент в мешках по 25 кг ☑ белорусского, ☑ российского, ☑ литовского производства.",google,"['z@mamont.by', 'zakup@mamont.by']","['+375173881504', '+375257504504', '+375293504504', '+375333504504', '+375445016003']",2025-09-15T13:41:04.359323
3,цемент купить,https://bobrujsk-praktik.by,Можно купить в интернет-магазине Практик. Цемент по выгодной цене. Есть рассрочка и бесплатная доставка.,google,['info@bobrujsk-praktik.by'],"['+375225708808', '+375225708908', '+375225726256', '+375291053338', '+375333778809', '+375445778808']",2025-09-15T13:41:04.359326
3,цемент купить,https://pinsk.bild-shop.by,"Цемент, известь ... 1,88 руб. В корзину. Пигмент ТС 313 желтый 300 гр. Пигмент ТС 313 желтый 300 гр. 4,5 руб. ... 4,99 руб. В корзину. Пигмент ТС 780 черный 500 гр.",google,"['info@bild-shop.by', 'offers@bild-shop.by']","['+375174237320', '+375174241515', '+375255456969', '+375291041740', '+375291132040', '+375291140061', '+375291190196', '+375291518500', '+375291608482', '+375291961986', '+375293796162', '+375295996969', '+375296788684', '+375445102902', '+375445221315', '+375445254414', '+375445356336', '+375445996969', '+375447121412', '+375447655536']",2025-09-15T13:41:04.359329
3,цемент купить,https://bild-shop.by,"Цемент, известь ... 1,88 руб. В корзину. Пигмент ТС 313 желтый 300 гр. Пигмент ТС 313 желтый 300 гр. 4,5 руб. ... 5,09 руб. В корзину. Пигмент ТС 780 черный 500 гр.",google,"['info@bild-shop.by', 'offers@bild-shop.by']","['+375174237320', '+375174241515', '+375255456969', '+375291041740', '+375291132040', '+375291140061', '+375291190196', '+375291518500', '+375291608482', '+375291961986', '+375293796162', '+375295996969', '+375296788684', '+375445102902', '+375445221315', '+375445254414', '+375445356336', '+375445996969', '+375447121412', '+375447655536']",2025-09-15T13:41:04.359332
3,цемент купить,https://medandmore.by,Интернет-магазин Med And More предлагает купить цементы стоматологические в Минске. Узнать цену вы можете на сайте или по ☎ 8-800-777-5000.,google,['info@medandmore.ru'],"['+74951775000', '+78007775000']",2025-09-15T13:41:04.359335
3,цемент купить,https://skladna.by,"Купить цемент в мешках от 25 кг до 50 кг в Слуцке оптом и в розницу. Широкий ассортимент: М 500, ДО 500, 500 Д20. ✓Быстрая доставка в Слуцке и по Беларуси.",google,['minsk@skladna.by'],"['+375173368404', '+375291116677']",2025-09-15T13:41:04.359339
3,цемент купить,https://xn--j1abciba1a.xn--90ais,"Розничная цена:11.50 руб. Еще (0). В наличии - 2. шт В корзину Подписаться В корзине. Портландцемент ЦЕМ I 42,5Н Д0 25кг , РБ.",google,"['molotok@bonados.by', 'sale1@bonados.by', 'sale3@bonados.by']","['+375162350077', '+375297450777', '+375336400555', '+375336400999', '+375447450777', '+74130341012']",2025-09-15T13:41:04.359342
3,цемент купить,https://ram-bud.by,"Заказывали цемент 25 кг, удобно перемещать, одного мешка хватает примерно на два замеса, с соотношением 1 ведро цемента + 3 песка. Все привезли достаточно ...",google,['ram-bud@mail.ru'],"['+375172802045', '+375293665446', '+375296727062', '+375297020860']",2025-09-15T13:41:04.359345
3,цемент купить,https://shop.parad.by,"Модифицированная сухая цементная смесь для приготовления безусадочных расширяющихся бетонов, строительных растворов, инъекционных растворов для усиления ...",google,['info@parad.by'],"['+375291102654', '+375297941172']",2025-09-15T13:41:04.359347
3,цемент купить,https://shop.vmk-dent.by,Стеклоиономерные цементы ... от 48.02 руб. 48.02 руб. ... от 27.45 руб. 27.45 руб. ... от 151.69 руб. 151.69 руб. ... от 46.59 руб. 46.59 руб. ... от 107.80 руб. 107.80 ...,google,['torg@vmk-dent.by'],"['+375173611187', '+375173611360', '+375173611361', '+375293194026', '+375295979449', '+375296848910']",2025-09-15T13:41:04.359350
3,цемент купить,https://mile.by,"В интернет-магазине Mile.by можно купить цемент в Минске или оформить заказ с доставкой по стране. Мы предлагаем цемент по низким ценам, а подобрать необходимую ...",google,"['cc@mile.by', 'dpo@mile.by', 'info@mile.by']","['+375173181333', '+375173475050', '+375173608211', '+375173771393', '+375173881055', '+375256615050', '+375295595050', '+375296337722', '+375447795050']",2025-09-15T13:41:04.359354
3,цемент купить,https://www.kufar.by,"Цемент Цемрос M500 ЦЕМ I 42.5 Н 25 кг ... 9.50 р. Цемент. Услуги доставки. Пинск, Брестская. 12 сент., 01:06. Договорная. Бетон для строительных ...",google,['marketing@kufar.by'],"['+73465077041', '+73499058852', '+79053603547', '+79712364827']",2025-09-15T13:41:04.359357
3,цемент купить,https://stroisiti.by,Закажите качественный цемент в Лиде с доставкой от СтройСити. Широкий ассортимент строительных материалов по выгодным ценам. Гарантия качества и быстрая ...,google,"['s293580015@gmail.com', 's6773610@gmail.com']","['+375292673610', '+375293139383', '+375293580015', '+375296773610']",2025-09-15T13:41:04.359360
3,цемент купить,https://www.udms.by,Тротуарная плитка цвета Белая плитка на белом цементе купить в Минске ✓ Выгодная цена ✓ Гарантия качества ✓ Узнать стоимость и размеры можно на сайте.,google,['udms@udms.by'],[],2025-09-15T13:41:04.359363
3,цемент купить,https://www.arsobeton.by,Нужен бетон М200? ☎ Звоните и заказывайте: +375 (29) 183-61-11. Собственное производство. Доставка по Минску и области.,google,['info@arsobeton.by'],['+375291836111'],2025-09-15T13:41:04.359366
3,цемент купить,https://gomelgraal.by,Цемент в мешках по 25 кг · Цемент ПЦ500 Д0 · Цемент ПЦ500 Д20. 1000. Вес: 25кг 8.00р. 8.00р. +. -. Купить. Купить в 1 клик. Показано с 1 ...,google,['gomelgraal@mail.ru'],"['+375291333311', '+375293171111']",2025-09-15T13:41:04.359368
3,цемент купить,https://gemma.by,"Купить известь, мел, цемент, гипс с доставкой в Гродно, Гомель, Витебск, Могилев, Брест и Минск по низким ценам. Строительный интернет-магазин Гемма. Тел.",google,['info@gemma.by'],"['+375295095835', '+375295132207', '+375336874236', '+375447870089']",2025-09-15T13:41:04.359371
3,цемент купить,https://dovatrade.by,В данном разделе представлена продукция Цемент марки ПЦ 500 Д20 высокого качества по низким ценам в Гродно. Заказать и купить Цемент марки ПЦ 500 Д20 с ...,google,"['dovatrade@mail.ru', 'dovatradelida@mail.ru']","['+375152670706', '+375152670709', '+375293115775', '+375295225588', '+375297199500', '+375445225588']",2025-09-15T13:41:04.359374
3,цемент купить,https://krasavolos.by,Купить Kérastase Resistance Ciment Thermique Resurfacing Strengthening Milk термо-цемент 150 мл. Профессиональные средства по уходу за волосами.,google,['sale@krasavolos.by'],['+375447500034'],2025-09-15T13:41:04.359377
3,цемент купить,https://www.serpa.by,"Сухие строительные смеси · По популярности · По алфавиту · По цене · Цемент. Быстрый просмотр. Цемент Портландцемент ЦЕМ I 42,5Н Д0, 25кг. Наличие уточняйте.",google,['info@serpa.by'],['+375333286286'],2025-09-15T13:41:04.359379
3,цемент купить,https://www.butb.by,"Купить цемент, газосиликатные блоки, щебень, смазочные материалы (смазки; СОЖ; моторное масло, трансмиссионное масло, компрессорное масло, ...",google,['uc@ecp.by'],"['+375293093232', '+375333093231']",2025-09-15T13:41:04.359382
3,цемент купить,https://vpozitive.by,"Цемент в мешках от 2 до 25 кг, всегда в наличии. Доставка на объект, рассрочка, дисконтная программа, скидки и акции.",google,['web@vpozitive.by'],"['+375296465454', '+375296735050', '+375296986969', '+375297160202']",2025-09-15T13:41:04.359406
3,цемент от производителя,https://bck.by,"Прейскуранты (заводов-изготовителей) для использования при строительстве объектов, производстве материалов для строительства (по предоплате). БЦЗ. Белорусский ...",google,['info@bck.by'],[],2025-09-15T13:41:07.720127
3,цемент от производителя,https://zzbo.by,Предлагаем мобильные горизонтальные силосы цемента от производителя. Силосы разработаны совместно с фабрикой SCUTTI Италия ... цемента до 15%. [parent] ...,google,['sales@zzbo.ru'],['+375333959016'],2025-09-15T13:41:07.720151
3,цемент от производителя,https://hanstroy.by,"Пена-цемент Makroflex объемом 850мл - идеальное решение для ремонтных работ. Серый цвет, время высыхания 12 часов. Производитель Makroflex.",google,['info@hanstroy.by'],['+375291654444'],2025-09-15T13:41:07.720158
3,цемент от производителя,https://ibmedia.by,"Aug 4, 2025 ... Беларусь значительно нарастила поставки цемента в Россию. Кто производит цемент в Беларуси? Почему выросли продажи в РФ?",google,['info@ibmedia.by'],"['+375173082828', '+375333502828']",2025-09-15T13:41:07.720166
3,цемент от производителя,https://zbi1.by,"Покупая цемент у нас, с нашей доставкой, Вы получите хорошее ценовое предложение — качественный цемент от производителя и оперативную доставку!",google,['zbi1info@gmail.com'],"['+375152655870', '+375152655872', '+375292439490', '+375339008888']",2025-09-15T13:41:07.720172
3,цемент от производителя,https://cementby.by,"Постоянными потребителями нашей продукции являются крупные строительные корпорации и фирмы Польши, Литвы, Латвии, Эстонии, России, Украины и Молдовы. СТАБИЛЬНОЕ ...",google,['info@cementby.by'],['+375151261071'],2025-09-15T13:41:07.720180
3,цемент от производителя,https://masterpola.by,Отдавайте предпочтение известным производителям с хорошей репутацией. Качественный цемент от надежного производителя — залог успешной стяжки. Цена. Цена не ...,google,['wordpress@example.com'],"['+375291099991', '+375297078949']",2025-09-15T13:41:07.720186
3,цемент от производителя,https://ram-bud.by,"Сфера применения Портландцемента М500 достаточно широка. Его используют в качестве основного компонента смесей для несущих конструкций: фундаментов, колонн.",google,['ram-bud@mail.ru'],"['+375172802045', '+375293665446', '+375296727062', '+375297020860']",2025-09-15T13:41:07.720193
3,цемент от производителя,https://www.arsobeton.by,"Jan 9, 2023 ... Зачастую бетон от производителя и цемент путают. Немногие знают об их особенностях и отличиях, ведь используются они для возведения больших ...",google,['info@arsobeton.by'],['+375291836111'],2025-09-15T13:41:07.720200
3,цемент от производителя,https://asoligorsk.by,"Если есть возможность купить цемент непосредственно с завода-изготовителя или в фирменном магазине - это идеальный вариант. Однако, у большинства ...",google,['info@asoligorsk.by'],[],2025-09-15T13:41:07.720204
3,цемент от производителя,https://pechnoi.by,"Купить в Минске по выгодным ценам кладочные смеси, цемент, песок. Доставка по Беларуси. Адрес склада: г. Минск, ул. Бабушкина, 48/2.",google,['pechki2015@yandex.ru'],"['+375173889484', '+375291671242', '+375292786742', '+375294911911', '+74169431752']",2025-09-15T13:41:07.720211
3,цемент от производителя,https://belarus-news.by,"Jul 19, 2025 ... Производители цемента в последние годы ориентированы на российский рынок. Основные потребители находятся в Москве и Московской области ...",google,['contact@ctv.by'],"['+375172906373', '+375172906413', '+375173616373', '+375173796413', '+375291600700']",2025-09-15T13:41:07.720217
