user_id,query,domain,description,engine,emails,phones,dateOfSearch
test_user,поставщики металла,https://ru.perfectmoc.com,Мы известны как один из ведущих производителей и поставщиков сайдинговых панелей из черного металла в Китае. Если вы собираетесь купить декоративные панели ...,google,['sales@perfectmaterial.cn'],['+8615318612516'],2025-09-12T03:05:15.370468
test_user,поставщики металла,https://novosibirsk.m-invest.ru,Компания «Металлинвест» предлагает широкий ассортимент металлопроката в Новосибирске по ценам производителя. Индивидуальные условия кредитования.,google,['novosib@m-invest.ru'],"['+73422591035', '+73433780777', '+73433787007', '+73435495777', '+73452538027', '+73462270398', '+73472269867', '+73512160137', '+73532541801', '+73832112921', '+73912793213', '+74951145298', '+78432318116', '+78612981916', '+78632040392']",2025-09-12T03:05:15.370502
test_user,поставщики металла,https://krasnodar.anepmetall.ru,"Компания «АНЭП-Металл» предлагает металлопрокат оптом от производителя в широком ассортименте. Мы сотрудничаем не только с крупными поставщиками металлопроката, ...",google,['b@anepmetall.ru'],['+78612025390'],2025-09-12T03:05:15.370510
3,майки купить,https://conteshop.by,Стильные женские домашние майки в интернет-магазине белорусской одежды Conte ◾ 18 товаров ◾ цена от 21.59 руб. до 42.99 руб. ◾ Conte Elegant ◾ скидки до 41%,google,['info@conteshop.by'],"['+375152509435', '+375152742453', '+375336226966']",2025-09-12T03:12:20.998068
3,майки купить,https://www.vsemayki.ru,"VSEMAYKI - лучший конструктор футболок с принтами на заказ. Недорогая печать принтов на футболках, толстовках, одежде, кепках, кружках, аксессуарах и ...",google,['info@vsemayki.ru'],"['+18099999999', '+18769999999', '+211999999999', '+21699999999', '+2209999999', '+22399999999', '+22799999999', '+22899999999', '+22999999999', '+23299999999', '+23599999999', '+2389999999', '+2399999999', '+243999999999', '+244999999999', '+249999999999', '+251999999999', '+25299999999', '+2639999999', '+2651999999', '+299999999', '+352999999999', '+35699999999', '+35799999999', '+359999999999', '+37499999999', '+376999999', '+4599999999', '+4799999999', '+50499999999', '+5079999999', '+50999999999', '+51999999999', '+529999999999', '+56999999999', '+593999999999', '+59899999999', '+628999999999', '+639999999999', '+66999999999', '+6749999999', '+6799999999', '+687999999', '+688909999', '+73422357996', '+73432885159', '+73472000687', '+73512003336', '+73912287027', '+74733003087', '+74956468767', '+78006001141', '+78126482433', '+78312808273', '+78432100966', '+78442962160', '+78462129539', '+78612025416', '+78633032199', '+79999999999', '+84999999999', '+8501919999999', '+85599999999', '+8562099999999', '+886999999999', '+919999999999', '+9599999999', '+9609999999', '+963999999999', '+96599999999', '+966599999999', '+96899999999', '+972599999999', '+97517999999', '+97699999999', '+989999999999', '+992999999999', '+994999999999', '+996999999999', '+998999999999']",2025-09-12T03:12:20.998081
3,майки купить,https://anta-sport.ru,"Мужские поло, футболки и майки Anta - купить в официальном интернет-магазине спортивной одежды и обуви Anta-sport.ru по цене ⭐ от 1156 руб.",google,['shop@anta-sport.ru'],"['+74991131888', '+78007073660']",2025-09-12T03:12:20.998088
3,майки купить,https://annapekun.ru,"Футболки и майки от ANNA PEKUN. Бесплатная доставка любого заказа по всей России, скидка 10% на первый заказ.",google,['info@annapekun.ru'],"['+79214194996', '+79999999999']",2025-09-12T03:12:20.998091
3,майки купить,https://menactive.com.ua,"Мы предлагаем не только широкий ассортимент, но и внушительный выбор размеров, от S до 4XL. Любой мужчина сможет найти майку, купив которую, он создаст по- ...",google,['menactive.com.ua@gmail.com'],[],2025-09-12T03:12:20.998092
3,майки купить,https://natali.ru,Женские футболки оптом купить можно в маркетплейсе «Натали». Яркие и современные изделия порадуют ваших покупателей. Стараемся для вас! 696 товаров. Фильтры и ...,google,['zakaz@natali37.ru'],['+74932475050'],2025-09-12T03:12:20.998094
3,майки купить,https://solmar.com.ua,"У нас вы найдете популярные виды маек: спортивные — удобные, без лишнего декора,. элегантные — легкие, с фигурным вырезом, на тонких бретелях,. для активного ...",google,['info@solmar.com.ua'],"['+24742475', '+380671892779']",2025-09-12T03:12:20.998096
3,майки купить,https://defile.ru,Купить футболки и майки в интернет-магазине Дефиле с доставкой по всей России недорого. Футболки и майки хорошего качества в большом ассортименте.,google,['eshop@defile.ru'],"['+78005507878', '+79204309255']",2025-09-12T03:12:20.998097
3,майки купить,https://alabel.su,"Топы и майки купить на сайте бренда ALÁBEL. Модная женская одежда из материалов премиум качества, индивидуальный пошив. Быстрая доставка в любую точку мира.",google,['alabel.su@ya.ru'],['+79326147043'],2025-09-12T03:12:20.998099
3,майки купить,https://v2sportdress.ru,Каталог футболок и маек для художественной гимнастики от олимпийской чемпионки и создателя бренда V2SD Веры Бирюковой. Доставка по Москве и РФ.,google,['hello@v2sportdress.ru'],['+79268401237'],2025-09-12T03:12:20.998100
3,майки купить,https://sportmaster.kz,"Для женщин, предпочитающих практичность и комфорт, интернет-магазин Спортмастер предлагает большой выбор маек. Модели от компаний Demix, Reebok, Termit, GSD, ...",google,['support@sportmaster.kz'],['+78000803333'],2025-09-12T03:12:20.998103
3,майки купить,https://choux.ru,"Футболки и майки – женская базовая одежда с доставкой по Москве, России. Официальный сайт CHOUX. Заказ по телефону☎️ +7(963) 716-84-88.",google,"['pd@choux.ru', 'support@choux.ru']","['+79168807949', '+79637168388', '+79637168488', '+79803958747']",2025-09-12T03:12:20.998105
3,майки купить,https://lsd-clothing.com,Предлагаем купить Майки и футболки Товаров в каталоге: 19. Доставка курьером до двери +375445425388.,google,['sales@lsd-clothing.com'],['+375445425388'],2025-09-12T03:12:20.998107
3,майки купить,https://m.oodji.com,"Майки, топы для женщин по доступным ценам в интернет-магазине oodji (104 шт. По цене от 174 р). Доставка или самовывоз по всей России.",google,['spp@oodji.com'],['+78007008929'],2025-09-12T03:12:20.998109
3,майки купить,https://www.shop.fc-zenit.ru,Мужские футболки · XS · S · M · L · XL · 2XL · 3XL · 4XL. до -15% по клубной карте. 7 799 ₽. Предзаказ. Домашняя оригинальная игровая футболка Jogel ФК «Зенит».,google,"['shop@fc-zenit.ru', 'shop@zenit-trade.ru']","['+77024177848', '+78005114327', '+78124380838']",2025-09-12T03:12:20.998110
3,майки купить,https://bns-club.ru,Топы и майки · Calvin Klein · DIESEL · DKNY · Karl Lagerfeld · Karl Lagerfeld Jeans · Michael Kors · Replay · Ruck&Maul; Tommy Hilfiger. Цвет. Все. Очистить.,google,['bnsclub_order@bns-group.ru'],['+78001009339'],2025-09-12T03:12:20.998112
3,производство кабелей,https://vikab.by,"Освоено производство проводов для воздушных линий электропередач. Стартовал выпуск силового кабеля марки АВВГ, неизолированных проводов марок А и АС, ...",google,['info@vikab.by'],"['+375212480112', '+375212480113']",2025-09-12T03:24:45.621773
3,производство кабелей,https://kamkabel.ru,"«Камский кабель» расположен в индустриальном сердце России — г. Перми. Предприятие производит кабели и провода, которые отправляются на крупнейшие стройки ...",google,['zakaz@kamkabel.ru'],['+78002205000'],2025-09-12T03:24:45.621797
3,производство кабелей,https://www.a-cab.ru,Узнайте подробную информацию о производителях от «Компании Альянс-Кабель». Звоните: ☎+7 (495) 419 17-57.,google,['order@a-cab.ru'],"['+74954191757', '+78003013121']",2025-09-12T03:24:45.621805
3,производство кабелей,https://www.mpkabel.ru,"Производственный потенциал завода обеспечивает полный технологический цикл изготовления кабелей и проводов: от волочения, скрутки, наложения экрана и оболочки ...",google,['sales@mpkabel.ru'],"['+74993462124', '+78005552124']",2025-09-12T03:24:45.621811
3,производство кабелей,https://www.regfile.ru,Эта группировка включает: - производство волоконно-оптических кабелей для передачи данных или прямой трансляции изображений. Эта группировка не включает:,google,['info@regfile.ru'],['+74952155330'],2025-09-12T03:24:45.621816
3,производство кабелей,https://akm-nn.ru,"UTP/FTP Indoor · 1. Токопроводящая жила – однопроволочная, мягкая медная проволока · 2. Изоляция проводника – полиэтилен высокой плотности, HDPE · 3. Разрывная ...",google,['info@akm-nn.ru'],['+78312820955'],2025-09-12T03:24:45.621821
3,производство кабелей,https://expert-cable.ru,"Кабельный Завод ""ЭКСПЕРТ-КАБЕЛЬ"" расположен в г. Орле и занимается разработкой и производством кабельно – проводниковой продукции как стандартных, так и ...",google,['sale@expert-cable.ru'],"['+74952486670', '+78007076670']",2025-09-12T03:24:45.621827
3,производство кабелей,https://greenconnect-russia.ru,"Псковский Завод Компьютерного Мобильного Кабеля в России. Кабель оптом от производителя. USB кабель, HDMI кабель, патч-корд, aux аудио кабель, VGA кабель, ...",google,['sales@gcr.com.ru'],"['+74996536408', '+78005057352', '+78123857262']",2025-09-12T03:24:45.621833
3,производство кабелей,https://spk-electric.ru,"Компания производит следующую продукцию: кабельно-проводниковая продукция, кабели и провода силовые гибкие, кабели и провода силовые стационарной прокладки < ...",google,['info@spk-electric.ru'],['+74951201438'],2025-09-12T03:24:45.621844
3,производство кабелей,https://tomskcable.ru,"Каталог кабелей торговой марки «ТОФЛЕКС» (32,48 MB). Кабели судовые Тофлекс КС (18,84 MB). Кабели для горнодобывающей промышленности (165 MB). Все каталоги.",google,"['cable@tomskcable.ru', 'marketing@tomskcable.ru', 'personal@tomskcable.ru']","['+73822311560', '+73822498009', '+73822498989', '+77017307579', '+79234427858']",2025-09-12T03:24:45.621848
3,производство кабелей,https://alphacable.ru,"Основной вид деятельности – производство кабельно-проводниковой продукции, которая востребована предприятиями различных сфер деятельности не только на ...",google,['info@alphacable.ru'],"['+74957400577', '+78005509945']",2025-09-12T03:24:45.621853
3,производство кабелей,https://elektrokable.ru,"Кабельные заводы - производители России · ООО ""Кабельный завод ""АЛЮР"" · ЗАО ""Завод ""Агрокабель"" · Совместное предприятие ЗАО ""Белтелекабель"" · OOO ""Дмитров-Кабель"".",google,['info@elektrokable.ru'],"['+74957980413', '+74957982905']",2025-09-12T03:24:45.621857
3,производство кабелей,https://tk-neva.ru,"ПРОДУКЦИЯ И УСЛУГИ. Кабели и провода. FLEXICORE, LAPP, TKD KABEL, SKT, UNIKA KABLO, HELKAMA, и ...",google,['company@tk-neva.ru'],"['+78126677701', '+79319584990']",2025-09-12T03:24:45.621861
3,производство кабелей,https://spkb.ru,Производство специальных огнестойких кабелей. Кабели в хладостойком исполнении. Низкотоксичные кабели для социальных объектов. Огнестойкие кабельные линии.,google,['sale@spkb.ru'],"['+74955056850', '+74999298675']",2025-09-12T03:24:45.621868
3,производство кабелей,https://incab.ru,"Завод по производству оптоволоконного кабеля №1 в России и СНГ. ✓ Производим оптику для подвеса, прокладки в грунт, трубы и канализацию.",google,"['mail@incab.ru', 'sales@incab.ru']",['+73422114141'],2025-09-12T03:24:45.621873
3,производство кабелей,https://cable-machine.ru,Технология производства кабеля · Вытягивание катанки из алюминия или меди до жилы заданного сечения. · Следующий этап — плавление полиэтилена (иного ...,google,['cable-machine@eg-mail.ru'],['+78003011938'],2025-09-12T03:24:45.621878
3,производство кабелей,https://okabel.ru,на мощностях и под контролем лидера по производству оптического кабеля в России и СНГ – завода Инкаб. №1. по объему производства оптического кабеля в ...,google,['mail@okabel.ru'],"['+73422060747', '+73422195575', '+73432887030', '+73432982028', '+73433444417', '+73433809000', '+73452489535', '+73452618269', '+73452638183', '+73472465176', '+73512200072', '+73832075356', '+73832853377', '+73833120434', '+73833891409', '+73912129994', '+73912165020', '+73912902206', '+73912913595', '+73952712915', '+74212788359', '+74232393899', '+74732021818', '+74951985580', '+74952807750', '+74956376317', '+74957863434', '+74993221699', '+74994504959', '+77016158725', '+77018067506', '+77212910116', '+77273508148', '+77777298683', '+78005004843', '+78005501941', '+78005504220', '+78005554919', '+78123193920', '+78123314041', '+78123354885', '+78125787770', '+78127401175', '+78312147117', '+78312350434', '+78312644221', '+78432042233', '+78442439798', '+78462030424', '+78463004959', '+78482379474', '+78612041434', '+78612126110', '+78612739903', '+78632308402', '+78632618210', '+79052048715', '+79159403127', '+79250816045', '+79321212128', '+79602608888', '+79877429648', '+994125259955', '+996701513811', '+998712058585', '+998909700440', '+998977407911', '+998977409722']",2025-09-12T03:24:45.621883
3,производство кабелей,https://nkz-nsk.ru,"Кабели контрольные КОД ОКП 35 6000. Продукция предназначена для фиксированного присоединения к стационарным электрическим приборам, аппаратам, сборкам ...",google,"['sale@nkz-nsk.ru', 'sales@nkz-nsk.ru']",['+73832858098'],2025-09-12T03:24:45.621888
3,производство кабелей,https://invest.gov.kz,"Sep 22, 2022 ... Компания специализируется на высокотехнологичном и экологичном производстве электрических кабелей. Продукция компании поставляется в более 20 ...",google,['info@invest.gov.kz'],"['+77172620620', '+77172620627']",2025-09-12T03:24:45.621897
3,производство кабелей,https://thecontacttrade.com,Категории · Лента серии · Серия металлической проволоки · Пряжа Веревочная серия · Пластиковые экструзионные материалы · Другая серия проводных кабелей · Другая ...,google,['info@thecontacttrade.com'],['+902244835202'],2025-09-12T03:24:45.621902
3,производство кабелей,https://www.energokab.ru,Кабельный завод Энергокабель – производство и продажа кабельно- проводниковой продукции. Купить кабель и провод в Москве и по всей России по оптовым ценам.,google,"['client@energokab.ru', 'eсab@energokab.ru']",['+74952218993'],2025-09-12T03:24:45.621908
3,производство кабелей,https://paritet.su,"Производство кабеля для автоматизации, СКС. Огнестойкая продукция для ОПС и СОУЭ. Ассортимент прайс-листа находится в наличии на складе, кабель отгружается ...",google,['zakaz@paritet.su'],"['+74958674858', '+74959262269']",2025-09-12T03:24:45.621915
3,кабели от производителя,https://sk.by,Купить комбинированные волоконно-оптические кабели напрямую с завода. В наличии и под заказ. Доставка по всей Беларуси +375 212 33-12-71.,google,['info@sk.by'],"['+375212331270', '+375212331271', '+74995005756', '+78005005756']",2025-09-12T03:24:48.298424
3,кабели от производителя,https://informsystema.com,"Кабели КСВВнг, КСВВГнг - что это? Купить оптом и в розницу напрямую с завода в Ростове на Дону. Доставка по всей России и в г. Ростов-на-Дону.",google,['info@informsystema.com'],"['+78632220984', '+78632230956', '+78632995099']",2025-09-12T03:24:48.298444
3,кабели от производителя,https://www.kramer.ru,"Переходник USB 3.1 тип C вилка на HDMI розетку, DisplayPort розетку, Ethernet розетку, Аудио розетку, 3хUSB 3.0 розетку и розетку USB 3.1 Type-C для зарядки ...",google,['help@kramer.ru'],['+74957800302'],2025-09-12T03:24:48.298449
3,кабели от производителя,https://tomskcable.ru,"Кабель оптом от производителя. Завод ТомскКабель предлагает купить кабель оптом в Москве, +7 (3822) 49-80-09.",google,"['cable@tomskcable.ru', 'marketing@tomskcable.ru', 'personal@tomskcable.ru']","['+73822311560', '+73822498009', '+73822498989', '+77017307579', '+79234427858']",2025-09-12T03:24:48.298456
3,кабели от производителя,https://intg.ru,Купить комбинированные волоконно-оптические кабели напрямую с завода. В наличии и под заказ. Доставка по всей России +7 (499) 500-57-56.,google,['info@intg.ru'],"['+375212331271', '+74995005756', '+78005005756']",2025-09-12T03:24:48.298461
3,кабели от производителя,https://inkateh.ru,Заказать кабели силовые для стационарной прокладки от производителя ИНКАТЕХ. Доставка по России. Звоните: +7 (351) 701-12-50.,google,['info@inkateh.ru'],['+78462265173'],2025-09-12T03:24:48.298466
3,кабели от производителя,https://yarcable.ru,"Силовые кабели с медными жилами от производителя. Безгалогенные силовые кабели ППГнг(А)-HF, ППГнг(А)-FRHF в исполнении ГОСТ и ТУ средним и крупным оптом, с ...",google,['yarcable@mail.ru'],['+78005500176'],2025-09-12T03:24:48.298470
3,кабели от производителя,https://rscable.ru,"Кабели представленные в нашем каталоге, имеют сертификаты качества от заводов производителей. Смотреть все · LAPP · АЛЮР · Кавказкабель · КМ-профиль · Конкорд.",google,['555metrov@rscable.ru'],['+74957108886'],2025-09-12T03:24:48.298475
3,кабели от производителя,https://kamkabel.ru,"Купить КШВЭПбШнг(А)-LS Кабели в ПВХ Шахтные, Экскаваторные в интернет-магазине производителя Камский Кабель ... от до. Сечение экрана, мм². от до. Исполнение ...",google,['zakaz@kamkabel.ru'],['+78002205000'],2025-09-12T03:24:48.298479
3,кабели от производителя,https://breaking-group.ru,"Кабель Breaking K02, USB-C - Lightning, Apple Watch Edition, 30W, 3.0А, 1м (Белый). Описание. Оптовая цена. По запросу. ""> Оптовая цена.",google,['info@breaking-group.ru'],['+79996262626'],2025-09-12T03:24:48.298484
3,кабели от производителя,https://kramer.by,"Кабели, разъёмы, инструмент ... Переходник USB 3.1 тип C вилка на HDMI розетку, DisplayPort розетку, Ethernet розетку, Аудио розетку, 3хUSB 3.0 розетку и розетку ...",google,"['ik@offtech.by', 'info@offtech.by', 'support@kramer.ru']","['+375175176338', '+375175176339']",2025-09-12T03:24:48.298489
3,кабели от производителя,https://kipavt.ru,"Нужен надежный силовой кабель? У нас — медные кабели 660В, ПВХ-изоляция, КУВЭВНГ и ДИАТЭК. Подберем нужное сечение (3х2.5 и другие). Доставка по РФ и СНГ, ...",google,['support@kipavt.ru'],"['+78002222867', '+79218572867']",2025-09-12T03:24:48.298493
3,кабели от производителя,https://ten24.com.ua,Термостойкие провода и кабели по выгодным ценам на сайте ten24.com.ua ✓ Изготовление всего за 1-5 дней ✓ Доступные цены ✓ Гарантия качества ✓ Собственное ...,google,['zakaz@ten24.com.ua'],"['+380487005285', '+380509952581', '+380800335675', '+380930196061', '+380968297209']",2025-09-12T03:24:48.298497
3,кабели от производителя,https://metallistcable.ru,Купить Кабели контрольные от производителя с доставкой. Подробное описание и характеристики Кабели контрольные ✔️ Широкий ассортимент ✔️ В наличии и под заказ ...,google,['metallistcable@mail.ru'],"['+73825441379', '+73847093506', '+73847159106', '+77007000059']",2025-09-12T03:24:48.298501
