user_id,query,domain,description,engine,emails,phones,dateOfSearch
3,купить пакеты,https://gemma.by,"Купить пакеты и мешки с доставкой в Гродно, Гомель, Витебск, Могилев, Брест и Минск по низким ценам. Строительный интернет-магазин Гемма. Тел. 509-58-35 ...",google,['info@gemma.by'],"['+375295095835', '+375295132207', '+375336874236', '+375447870089']",2025-09-15T14:11:56.286587
3,купить пакеты,https://bobrujsk-praktik.by,"Мешки и пакеты · Мешок усиленный для строительного мусора с ПП нитью 50x90 см синий (4814273004544) · Мешок сетчатый для овощей 40x60см, до 20кг (с завязками).",google,['info@bobrujsk-praktik.by'],"['+375225708808', '+375225708908', '+375225726256', '+375291053338', '+375333778809', '+375445778808']",2025-09-15T14:11:56.286592
3,купить пакеты,https://workaut.by,"Пакеты для стерилизации инструментов СтериТ Винар с индикаторами класса 1 ПКСТУ | купить в Минске с доставкой по РБ: Витебске, Гомеле, Бресте, Могилеве, ...",google,['info@workaut.by'],"['+375173889292', '+375296129303']",2025-09-15T14:11:56.286597
3,купить пакеты,https://vestpak.by,"Бумажные, полиэтиленовые, фасовочные пакеты, пакеты майка в каталоге «Вестпак». Работаем с ЮР лицами, ИП. Резервируем товар, поддерживаем ассортимент на ...",google,['info@vestpak.by'],['+375447992000'],2025-09-15T14:11:56.286603
3,купить пакеты,https://ksk.by,"Каталог мешки, пакеты для мусора в интернет-магазине KSK. Большой ассортимент мешки, пакеты для мусора с доставкой по Гомелю и регионам Беларуси. Наличный, ...",google,['info@ksk.by'],"['+375232241985', '+375232242466', '+375232347735', '+375445252694', '+375445252695', '+375445252696', '+375447462222']",2025-09-15T14:11:56.286613
3,купить пакеты,https://toriya.by,"Пакеты · Пакет фасовочный ПНД Экстра 30х40, 12мкм, 500шт · Пакет фасовочный ПНД 14+8х35, 8мкм · Пакет с замком Zip Lock 5х7см, 100шт · Пакет фасовочный ПНД ...",google,['info@toriya.by'],"['+375172717779', '+375291117911', '+375291117971']",2025-09-15T14:11:56.286623
3,купить пакеты,https://3ceni.by,"Мы предлагаем подарочные пакеты различных цветов, включая популярные металлизированные оттенки золота и серебра. Многие пакеты имеют дополнительные особенности, ...",google,"['anti-corruption@3ceni.by', 'info@3ceni.by']",['+375291556572'],2025-09-15T14:11:56.286627
3,купить пакеты,https://www.officeton.by,"Купить зип-пакеты оптом в интернет-магазине Офистон. Оплата по безналичному расчёту с доставкой по Минску и Минской области — Солигорск, Жодино, Борисов, ...",google,['info@officeton.by'],"['+375173885959', '+375333182182', '+375445182182']",2025-09-15T14:11:56.286632
3,купить пакеты,https://pakplast.by,"(x 1 шт.) Количество - · +. Заказать. 8,74 р. Новинка. Освежитель воздуха ... Пакеты бумажные с окном · Пакеты бумажные с плоским дном · Пакеты бумажные с ...",google,['info@pakplast.by'],"['+375152605093', '+375152605094', '+375293856566', '+375295851416']",2025-09-15T14:11:56.286636
3,купить пакеты,https://tiz.by,"Пакеты минераловатные прошивные ППТ - широкий выбор по доступным ценам. ✓ Бесплатная доставка по Беларуси! ✓Гарантия, опт, рассрочка. ☎️ +375 (44) 7693485.",google,['info@tiz.by'],"['+375173365514', '+375296230855', '+375296737662', '+375447693485']",2025-09-15T14:11:56.286642
3,купить пакеты,https://kinglet.by,"Био-пакеты рекомендованы для упаковки пищевых продуктов и полностью разлагаются при компостировании как домашнем, так и промышленном. Не смотря на то, что пакет ...",google,['info@kinglet.by'],['+375447722922'],2025-09-15T14:11:56.286646
3,купить пакеты,https://www.ipack.by,"Настольные ручные запайщики (спайщики) пакетов, импульсные и постоянного нагрева, от известных китайских производителей. Серии: FS, FKR, SP.",google,['info@ipack.by'],"['+375173920553', '+375293330608', '+375333330476']",2025-09-15T14:11:56.286651
3,купить пакеты,https://green-dostavka.by,"Пакеты, мешки для мусора в Green: ◾ С завязками, ◾ С ароматом и др. Актуальный каталог товаров для уборки с ценами. ✓ Бесплатная доставка по Минску от 45 ...",google,['shop@green-market.by'],"['+375293815857', '+375293945857', '+375296245859', '+375296495859', '+375296527567', '+375296905859', '+375296945857', '+375296980187', '+375445066566', '+375445075756', '+375445211771', '+375445213293', '+375445216684', '+375445224501', '+375445226768', '+375445234676', '+375445235859', '+375445322789', '+375445404246', '+375445405591', '+375445405601', '+375445475354', '+375445484595', '+375445527657', '+375445606061', '+375445765756', '+375445976264', '+375447175758', '+375447385756', '+375447475658', '+375447507148', '+375447535859', '+375447565756', '+375447585758', '+375447599655', '+375447610655', '+375447798756', '+375447905857', '+375447925756', '+77292688862', '+79169646397']",2025-09-15T14:11:56.286656
3,купить пакеты,https://belmedtehnika.by,Пластина двухкомпонентного калоприемника Coloplast Alterna WearLife. 10.41 руб. – 12.11 руб. В Избранное · Мешок Coloplast Alterna уростомный прозрачный. 10.74 ...,google,"['medshop@belmt.com', 'rozn@belmt.com']",['+375445719583'],2025-09-15T14:11:56.286660
3,купить пакеты,https://ggn.by,"Пакеты для мусора ""Хатнiк"" 60л из полиэтилена низкого давления (ПНД) предназначены для сбора и транспортировки бытового мусора.",google,['ggn101000920@gmail.com'],"['+375173996895', '+375259487205', '+375291203042', '+375293283100', '+375293296488', '+375293831309', '+375296200702', '+375296265575']",2025-09-15T14:11:56.286666
3,купить пакеты,https://gala-mart.by,Контейнеры и пакеты для уборки заказать по низкой цене и забрать самовывозом уже через час ✓фото товара ✓характеристики ✓описание ✓отзывы ✓рейтинг в ...,google,['sale@galamart.ru'],"['+375295001016', '+73369705224', '+73889822938', '+74230001455', '+74267922837', '+74720573945', '+74720669172', '+78310044188', '+78567259395', '+78698951037', '+79160374299', '+79246168424', '+79577523098', '+79602893707', '+79661052823', '+79827300611', '+79945711975', '+79961752343']",2025-09-15T14:11:56.286670
3,купить пакеты,https://www.postroyka.by,"Мешки для строительного мусора, пакеты для мусора по выгодным ценам ✓ оптом и в розницу ✓ всегда в наличии ✓ доставка по Минску и всей Беларуси.",google,['mail@postroyka.by'],"['+375172151465', '+375172151740', '+375172152626', '+375173600118', '+375296115959', '+375296285959', '+375296585959', '+375296595959', '+375296795959', '+375296835959', '+375336115959', '+375336285959', '+375336585959', '+375336595959', '+375336795959', '+375336835959']",2025-09-15T14:11:56.286674
3,купить пакеты,https://bel7.by,"Вес пакета составляет 35 г., размеры – 90x130x8 мм. Средство защищено патентом РФ и не имеет аналогов за рубежом. ... В целях профилактики: равномерно нанести ...",google,['info@belseven.by'],"['+375172518712', '+375291030718', '+375291030740', '+375291301924', '+375293917772', '+375447111779']",2025-09-15T14:11:56.286680
3,купить пакеты,https://belita-shop.by,В нашем интернет-магазине вы можете купить подарочную упаковку Белита: выбирайте и заказывайте подарочные наборы на сайте. Доставка по Минску и Беларуси.,google,"['desk@belita-shop.by', 'zakaz@belita-shop.by']","['+375256122727', '+375296122727', '+375296775355', '+375336122727']",2025-09-15T14:11:56.286686
3,купить пакеты,https://www.y-r.by,"Купить упаковку для подарка: сумки, пакеты и косметички в официальном интернет-магазине Yves Rocher Доставка по Минску и всей Беларуси ✓ Цены ✓ Отзывы ...",google,['contact@y-r.by'],"['+375173181333', '+375173577399', '+375173744858', '+375173771393', '+375295318080']",2025-09-15T14:11:56.286692
3,коробки купить,https://redpack.by,Коробки из гофрокартона оптом и в розницу. Первый поставщик. Широкий выбор. Наличие на складе и под заказ. Оперативная доставка по РБ и самовывоз.,google,['info@redpack.by'],['+375291072727'],2025-09-15T14:13:32.070727
3,коробки купить,https://korobox.by,"Korobox.by - идеальные упаковочные решения по ценам от производителя! Архивные короба, транспортная тара, листовой картон, пузырьковая и стрейч пленка.",google,['zakaz@korobox.by'],"['+375296020698', '+375296021103']",2025-09-15T14:13:32.070735
3,коробки купить,https://pandaprint.by,Коробки по размерам (мм) (1063) · Крафт-коробки без окна (64) · Крафт-коробки с прозрачным окном (45) · Крафт-коробки с рисунком (639) ...,google,['6055969@mail.ru'],"['+375291207722', '+375291250077', '+375297122267', '+375445972207']",2025-09-15T14:13:32.070736
3,коробки купить,https://korobkikartonnyekupit.by,Коробки для упаковки товаров на Wildberries и Ozon. В наличии и под заказ. со ... Упаковочные коробки. - для посылок; -для пиццы; -для тортов; -ящики для ...,google,['optopack.by@yandex.by'],['+375333725301'],2025-09-15T14:13:32.070739
3,коробки купить,https://www.officeton.by,"Купить Коробки архивные и механизмы оптом в интернет-магазине Офистон. Оплата по безналичному расчёту с доставкой по Минску и Минской области — Солигорск, ...",google,['info@officeton.by'],"['+375173885959', '+375333182182', '+375445182182']",2025-09-15T14:13:32.070740
3,коробки купить,https://bobrujsk-praktik.by,"В коллекции имеются изделия разных видов, размеров, разной степени защиты. Перед тем как купить коробку под розетку, необходимо проконсультироваться с ...",google,['info@bobrujsk-praktik.by'],"['+375225708808', '+375225708908', '+375225726256', '+375291053338', '+375333778809', '+375445778808']",2025-09-15T14:13:32.070742
3,коробки купить,https://www.salmo.by,"Большой выбор коробок для рыбалки: для приманок, воблеров, крючков и прочих мелочей ⭐ Рыболовные коробки Meiho, Salmo, Flambeau. Приятные цены, скидки и ...",google,['online@salmo.by'],"['+375297361122', '+375447361122']",2025-09-15T14:13:32.070743
3,коробки купить,https://bylectrica.by,Серия: Коробки монтажные. Коробка монтажная КМ-275 сосна белёная. Цена за 1 шт.: 2.60 BYN. Коробка - 120 шт. Коробка монтажная. Посмотреть подробнее.,google,['sbyt@bylectrica.by'],"['+375172445401', '+375291955408', '+375447535069']",2025-09-15T14:13:32.070744
3,коробки купить,https://kaskadenergo.by,"Пластиковые коробки – легкие, удобные в монтаже, обладают высокой электроизоляцией, устойчивы к коррозии. Металлические коробки – прочные, подходят для ...",google,['kaskadenergo@mail.ru'],"['+375173880767', '+375445467566', '+375447280767']",2025-09-15T14:13:32.070746
3,коробки купить,https://gemma.by,"Коробка монтажная Bylectrica КМ-274 для разводки проводов ... 2,49 руб/шт. Коробка монтажная Bylectrica КУ-442 для углового монтажа. В корзину. Код: 250411 ...",google,['info@gemma.by'],"['+375295095835', '+375295132207', '+375336874236', '+375447870089']",2025-09-15T14:13:32.070747
3,коробки купить,https://laserstream.by,Купить самосборные коробки по доступным ценам⭐ Быстрая доставка по всей РБ или самовывоз. Звоните и заказывайте ☎︎ +375 44 52-52-737.,google,"['info@laserstream.by', 'iptitovecsv@mail.ru']","['+375296680906', '+375445252737', '+73885582327']",2025-09-15T14:13:32.070748
3,коробки купить,https://ksk.by,"Купить коробки распределительные (подрозетники) в интернет-магазине Строймаркет KSK. Большой ассортимент. Бесплатная доставка по Гомелю, области и Беларуси.",google,['info@ksk.by'],"['+375232241985', '+375232242466', '+375232347735', '+375445252694', '+375445252695', '+375445252696', '+375447462222']",2025-09-15T14:13:32.070750
3,коробки купить,https://optopack.by,✓ Цены с НДС. 600х400х400 ...,google,['optopack.by@yandex.by'],['+375333725301'],2025-09-15T14:13:32.070751
3,коробки купить,https://aks.by,"В интернет-магазине AKS вы можете выбрать и купить сушка для посуды 500 standard 1, белый rejs (без коробки) оптом и в розницу Доставка по Беларуси ...",google,"['mail@aks.by', 'zakaz@aks.by']","['+375162210465', '+375162539928', '+375293274286', '+375293274289', '+375295008500', '+375333619900', '+375445008500']",2025-09-15T14:13:32.070753
3,коробки купить,https://karas.by,"1667 моделей ☆ Ящики для зимней рыбалки в Минске ➢лучшие цены! Покупайте ящики для рыбалки, коробки для рыболовных снастей ➡Бесплатная доставка по всей ...",google,['mail@karas.by'],[],2025-09-15T14:13:32.070754
3,коробки купить,https://www.postroyka.by,Монтажные коробки для розеток под гипсокартон купить в Минске по низкой цене. ✴️ 6 складов-магазинов в Минске. ✔️Доставка по Беларуси. ✔️15 лет на рынке РБ.,google,['mail@postroyka.by'],"['+375172151465', '+375172151740', '+375172152626', '+375173600118', '+375296115959', '+375296285959', '+375296585959', '+375296595959', '+375296795959', '+375296835959', '+375336115959', '+375336285959', '+375336585959', '+375336595959', '+375336795959', '+375336835959']",2025-09-15T14:13:32.070755
3,коробки купить,https://office.by,"В нашем интернет-магазине вы можете купить архивные короба производства Brauberg, Forpus, OfficeSpace и Silwerhof, позволяют структурировать документы, ...",google,['info@office.by'],"['+375173969636', '+375295555040', '+375295955559']",2025-09-15T14:13:32.070757
3,коробки купить,https://gala-mart.by,Коробки и мешки заказать по низкой цене и забрать самовывозом уже через час ✓фото товара ✓характеристики ✓описание ✓отзывы ✓рейтинг в интернет-магазине ...,google,['sale@galamart.ru'],"['+375295001016', '+73369705224', '+73889822938', '+74230001455', '+74267922837', '+74720573945', '+74720669172', '+78310044188', '+78567259395', '+78698951037', '+79160374299', '+79246168424', '+79577523098', '+79602893707', '+79661052823', '+79827300611', '+79945711975', '+79961752343']",2025-09-15T14:13:32.070760
3,коробки купить,https://sweetart.by,"Коробка для торта 26х26х30 см с окном и ручками, белая. 3.10 Br – 28.00 Br Диапазон цен: 3.10 Br – 28.00 Br Выберите параметры Этот товар имеет несколько ...",google,['info@sweetart.by'],"['+375222429061', '+375298003620']",2025-09-15T14:13:32.070761
3,коробки купить,https://grodtorgmash.com,Коробки стерилизационные – купить по доступной цене. Быстрые сроки поставки по Беларуси. Высокий уровень обслуживания. Гарантия качества! | Страница: 1.,google,"['info@grodtorgmash.com', 'sales@grodtorgmash.com']","['+375152625038', '+375333001040', '+375333005090', '+375336222799']",2025-09-15T14:13:32.070763
3,коробки купить,https://sdelaysam.by,Большой каталог монтажных коробок в строительном магазине «СделайСам». ✓ Купить монтажные распячные коробки в Минске. Доставка по РБ.,google,['1403030@mail.ru'],"['+375175660030', '+375291403030', '+375291403080', '+375291413030', '+375291463030', '+375291901372', '+375291905468', '+375293408277', '+375298433080']",2025-09-15T14:13:32.070764
3,коробки купить,https://exim.by,"Распределительные коробки для электропроводки, корпуса Spelsberg купить в Минске ✓ Интернет-магазине Эксимэлектро ✓ Доставка по Беларуси. ☎ +375 (29) ...",google,['info@exim.by'],"['+375173734411', '+375173734422', '+375291760892', '+79999999999']",2025-09-15T14:13:32.070766
3,коробки купить,https://www.attrade.by,"Коробки ответвительные в Минске, купить коробки ответвительные по доступной цене от компании АЛТЕХНОТРЕЙД, гарантия, большой выбор, только проверенные ...",google,['info@attrade.by'],"['+375173884060', '+375292612505', '+375445867823']",2025-09-15T14:13:32.070767
3,коробки купить,https://6element.by,10.90 р. (с НДС). В корзину. Коробка распределительная ОП 150х110х70мм IP54 10 выходов 6 гермовводов крышка на винтах сер. Epplast 210302. Хит. КОД: 516723.,google,['zakazkabel@bk.ru'],"['+375232347735', '+375255305305', '+375292305305', '+375293650650', '+79123456789']",2025-09-15T14:13:32.070768
3,коробки купить,https://elswi.by,Оптовая продажа монтажных коробок ⭐️ Доставка по РБ ⭐️ Выгодные цены для юридических лиц ⭐️ Гарантия качества ☎ +375 29 679-40-64.,google,"['pss.sergei@gmail.com', 'sbyt001@elswi.by']","['+375172091286', '+375172302486', '+375172302489', '+375172302491', '+375296794064', '+375296794069', '+78796730728']",2025-09-15T14:13:32.070770
3,коробки купить,https://mile.by,Цена интернет-магазинаВ розничных магазинах цена товара может отличаться. puzzle. от 0.22 руб./мес. arrow. +. -. В корзину. Купить в 1 клик. Узнать о снижении ...,google,"['cc@mile.by', 'dpo@mile.by', 'info@mile.by']","['+375173181333', '+375173475050', '+375173608211', '+375173771393', '+375173881055', '+375256615050', '+375295595050', '+375296337722', '+375447795050']",2025-09-15T14:13:32.070772
3,коробки купить,https://etprom.by,Монтажные коробки купить в интернет-магазине ЭлектроТехИмпорт ✓ Большой выбор электротехнической продукции по низким ценам ✓ Доставка по Минску и Беларуси ...,google,['shop@etprom.by'],"['+375296900165', '+375333155900']",2025-09-15T14:13:32.070773
3,коробки купить,https://nvm.by,Распределительные коробки и другая электротехническая продукция от официального поставщика в Минске. ✔️ Доставка по всей РБ ✔️ Низкие цены ✔️ ☎ +375 (29) ...,google,"['anischikvadim@tut.by', 'nvmelectro@yandex.by']","['+375291597212', '+375293177212', '+375445648477']",2025-09-15T14:13:32.070775
3,картонные коробки производство,https://m-box.by,"Размер стандартного листа — 800х1200 мм, что делает его удобным для изготовления коробок и упаковочных изделий большого формата и с повышенными требованиями к ...",google,"['absolutpack@mail.ru', 'info@m-box.by']",['+375445047474'],2025-09-15T14:13:35.866721
3,картонные коробки производство,https://www.kaskadenergo.by,Изготовление нестандартных соединительных (распределительных) коробок · Изготовление щитка учёта электроэнергии выносного типа · Изготовление нестандартных ...,google,['kaskadenergo@mail.ru'],"['+375173880767', '+375445467566', '+375447280767']",2025-09-15T14:13:35.866727
3,картонные коробки производство,https://www.donarit.com,Коробки и ⭐ любая упаковка по низкой стоимости ⭐ на сайте Донарит! ⏰ Быстрое изготовление картонных коробок в фирменном или подарочном стиле ⭐ от типографии ...,google,['donarit@donarit.com'],"['+375173897300', '+375292767929', '+375296867929']",2025-09-15T14:13:35.866729
3,картонные коробки производство,https://printpoint.by,Производство картонных коробок на заказ в Минске. Круглые и любые другие формы и размеры! Брендированные коробки из картона. Упаковочные коробки с печатью.,google,['vladprintpoint@yandex.ru'],"['+375259582806', '+79068650515']",2025-09-15T14:13:35.866731
3,картонные коробки производство,https://optopack.by,"Приобретайте наши короба оптом для работы, для бизнеса, для дома. Производство коробок под заказ от 500 шт ... Коробки картонные оптом © 2025 OptoPack.by",google,['optopack.by@yandex.by'],['+375333725301'],2025-09-15T14:13:35.866732
3,картонные коробки производство,https://welpack.by,Главная · О Нас · История предприятия · Наши награды · Галерея · Вакансии · Продукция · Гофрированный картон · Четыреклапанный ящик · Сложная высечка.,google,['info@welpack.by'],"['+375164254585', '+375447605111', '+375447869722']",2025-09-15T14:13:35.866734
