user_id,query,domain,description,engine,emails,phones,dateOfSearch
3,этикетка,https://belkassa.by,"Этикетка с/к 58*30мм. Самоклеящиеся этикетки из специальной термобумаги, которые поставляются в роликах. Печать осуществляется на термо принтере методом прямого ...",google,['belkassa@tut.by'],"['+375173956555', '+375212616555', '+375293536555', '+375296376555', '+375297156555', '+375333435355']",2025-09-18T13:25:08.909590
3,этикетка,https://unimark.by,Изготавливают золотистые и серебристые металлизированные этикетки из полиэстера. На оборотную сторону бирок наносится клеевой слой. Для лучшего сцепления ...,google,['info@unimark.by'],"['+375172504545', '+375295583030', '+375445583030']",2025-09-18T13:25:08.909593
3,этикетка,https://oblakoprint.by,Печать на круговой этикетке БОПП с доставкой по всей Республики Беларусь. Узнайте стоимость печати вашего заказа за 10 минут. Являемся сервис-провайдером в ...,google,['oblakoprint.by@gmail.com'],['+375445364717'],2025-09-18T13:25:08.909595
3,этикетка,https://daliban.by,В нашем магазине вы можете купить этикет-ленту и термоэтикетку по оптовой цене с доставкой по Беларуси от прямого поставщика.,google,['info@daliban.by'],"['+375173882829', '+375173966206', '+375293966205', '+375293966206', '+375297076206']",2025-09-18T13:25:08.909598
3,этикетка,https://druk-s.by,"Закажите печать этикеток под ключ: разработка макета, подбор материала и формы, постпечатная обработка, доставка до дверей. Быстро, качественно, в срок.",google,['info@druk-s.by'],"['+375172242224', '+375173177875', '+375291737877', '+375293346629', '+375296737582']",2025-09-18T13:25:08.909602
3,этикетка,https://antarion.by,"Этикетки для крышки ведра (набор из 6 цветов) ... Цена за шт. 10.16 руб. шт. В корзинуВ корзине. Характеристики. ID, 91000167. Артикул, ETI RESINA6. Количество ...",google,['blum@antarion.by'],"['+375173200100', '+375293940100', '+375333640100']",2025-09-18T13:25:08.909605
3,этикетка,https://etiketka.com.by,Мы предлагаем · Чековая лента · Самоклеящаяся этикетка · Этикет-лента для маркировочных пистолетов · Этикет-пистолеты · Флексопечать печать на бумаге и пленке.,google,"['anna_vasilenko@ntsretail.by', 'ntspoligrafia@mail.ru']","['+375173171533', '+375232246244', '+375234065189', '+375296109157', '+375445359125', '+375447774014']",2025-09-18T13:25:08.909608
3,этикетка,https://mertech.by,"Допустимая площадь этикеток для FBO равна 30×20 мм, 43×25 мм, 58×40 мм. Этикетки требуется наклеить не только на товары, но и на дополнительную упаковку.",google,['info@mertech.by'],"['+375293117776', '+375293807776']",2025-09-18T13:25:08.909612
3,этикетка,https://shop-belblank.by,"В каталоге широкий выбор самоклеящейся бумаги, этикеток и ценников. ✓ для принтеров и копировальных аппаратов ✓ для этикет-пистолетов ✓ для маркировки ...",google,['buy@belblanc.by'],"['+375172151465', '+375173006722', '+375445550568']",2025-09-18T13:25:08.909630
3,этикетка,https://spektrpress.by,"Этикетка для сыра ПАРМЕЗАН — это не просто наклейка, а настоящее произведение искусства, созданное с заботой о вашем продукте и его потребителях.",google,"['info@spektrgroup.by', 'rus@spektrgroup.by']","['+375152474747', '+375293433222', '+375333488222', '+79056962069']",2025-09-18T13:25:08.909636
3,этикетка,https://artery.by,"Этикетки самоклеящиеся, ценники можно выбрать и купить в нашем каталоге. Самый крупный склад канцелярских товаров в Гродненской области.",google,['office@artery.by'],"['+375152603317', '+375293663317', '+375333663317']",2025-09-18T13:25:08.909638
3,этикетка,https://xn--b1aaeeabb0hpc6ae.xn--90ais,Cas CL3000-30P (TCP/IP). Весы с печатью этикеток до 30 кг с точностью 5/10 г. Внесены в Госреестр РБ. Гарантия 1 год. Очень быстрая доставка по Белоруси.,google,['sales@1vesovoy.by'],"['+375173880717', '+74997556597']",2025-09-18T13:25:08.909641
3,этикетка,https://vormatic.by,"Антикражная радиочастотная этикетка 40х40мм черная применяется для скрытой защиты товаров, например: внутри книги, коробки, кармана.",google,['sale@vormatic.ru'],['+79601183838'],2025-09-18T13:25:08.909644
3,этикетка,https://lsys.by,"Купить Светосигнальная арматура Eaton в Минске. Держатель этикеток Titan M22S-ST-X, h=50мм от официального дистрибъютера lsys.by.",google,['office@lsys.by'],"['+375172471999', '+375297871999', '+375445671999']",2025-09-18T13:25:08.909646
3,этикетка,https://prodavan.by,"Они представляют собой рулоны или листы с этикетками, готовыми к нанесению на любую подходящую поверхность. В линейке ТЭКО ТТОР предлагаются различные размеры, ...",google,['info@prodavan.by'],"['+375255016878', '+375293117292']",2025-09-18T13:25:08.909650
3,этикетка,https://www.aversys.by,Недорогие универсальные намотчики этикеток серии Labelmate MINI-CAT способны наматывать рулоны любых этикеток шириной до 115 мм со скоростью до 50 cм/сек.,google,['info@aversys.by'],"['+375173544415', '+375291114415', '+375291779900', '+73883764811', '+78573179143', '+79277179546', '+79976963695']",2025-09-18T13:25:08.909653
3,этикетка,https://www.24print.by,"Этикетки на бутылках — это не просто кусок бумаги или пленки с информацией о товаре. Это важный элемент брендинга, который способен значительно повлиять на ...",google,['info@24print.by'],"['+375173276191', '+375291233535', '+375296102424', '+375296602424']",2025-09-18T13:25:08.909656
3,этикетка купить,https://www.pos.by,"Самоклеящиеся этикетки подходят для оборудования брендов: TSC, Gainscha, DBS, HPRT, GPrinter, Honeywell, XPrinter, Zebra, Godex и др. Примеры стандартных ...",google,['info@pos.by'],"['+375172570303', '+375172579199', '+375173881616', '+375296013020', '+375298350295']",2025-09-18T13:57:31.547040
3,этикетка купить,https://unimark.by,"Их применяют в качестве наглядного носителя текстовой, графической информации, штрих-кода или QR-кода. Активно используются для идентификации оборудования и ...",google,['info@unimark.by'],"['+375172504545', '+375295583030', '+375445583030']",2025-09-18T13:57:31.547068
3,этикетка купить,https://shop-belblank.by,"Бумага самоклеющая, этикетки и ценники.",google,['buy@belblanc.by'],"['+375172151465', '+375173006722', '+375445550568']",2025-09-18T13:57:31.547079
3,этикетка купить,https://yudway.by,Клиент подбирает необходимый ему размер в зависимости от размеров маркируемого изделия и требований маркировки к нему. Стандартными принято считать такие ...,google,"['//office@yudway.by', 'office@yudway.by']","['+375173360464', '+375173360465', '+375296666489', '+375336666492', '+375336666497']",2025-09-18T13:57:31.547085
3,этикетка купить,https://amway-shop.by,"Товары для дома Amway: дозаторы, емкости и этикетки, в интернет-магазине Amway-Shop.by в Беларуси. ✓ Большой ассортимент товаров по низкой цене с ...",google,['info@amway-shop.by'],['+375293371121'],2025-09-18T13:57:31.547091
3,этикетка купить,https://vormatic.by,"Защитные антикражные этикетки — противокражные плоские наклейки небольших размеров, выполненные чаще всего в виде штрих-кода, наклеивающиеся на товар или ...",google,['sale@vormatic.ru'],['+79601183838'],2025-09-18T13:57:31.547096
3,этикетка купить,https://ronex.by,Весы торговые с печатью этикеток ... 2 014 р. В корзину В корзине. Оформить заказ! ... 2 014 р. В корзину В корзине. Оформить заказ! ... 2 014 р. В корзину В корзине.,google,"['info@ronex.by', 'zakaz@ronex.by']","['+375173970773', '+375293187526', '+375293887575', '+74951234567']",2025-09-18T13:57:31.547101
3,этикетка купить,https://xn--b1aaeeabb0hpc6ae.xn--90ais,Весы с печатью этикеток. Многое в наличии. Удобный сайт ▶︎ Скидки юридическим лицам до 20%. Отгружаем в день заказа. Доставка по всей Беларуси. Эксперты в ...,google,['sales@1vesovoy.by'],"['+375173880717', '+74997556597']",2025-09-18T13:57:31.547106
3,этикетка купить,https://www.officeton.by,"Купить Самоклеящиеся этикетки оптом в интернет-магазине Офистон. Оплата по безналичному расчёту с доставкой по Минску и Минской области — Солигорск, Жодино, ...",google,['info@officeton.by'],"['+375173885959', '+375333182182', '+375445182182']",2025-09-18T13:57:31.547111
3,этикетка купить,https://astrajet.by,Нужен принтер этикеток? Астраджет предлагает принтер для печати этикеток ✔️ для маркетплейсов купить с доставкой по Беларуси и России ⭐ с расширенной ...,google,['mail@astrajet.by'],"['+375445253262', '+375447882462', '+375447882532']",2025-09-18T13:57:31.547115
3,этикетка купить,https://www.vlgroup.by,"Печать и изготовление наклеек в Минске. Заказать этикетки любой формы и размера, подрезка по контуру, сквозная прорезка. Купить самоклеящиеся этикетки.",google,['vlgroup@yandex.ru'],"['+375172250090', '+375172251960', '+375172256577', '+375172257017', '+375293877017', '+375295777017']",2025-09-18T13:57:31.547119
3,этикетка купить,https://selectneo.by,Пломба наклейка 60*20мм/ с оставлением следа. Цена: 0.12 р. (шт.) Подробнее. ﻿. Пломба наклейка круглая 20*20мм. Пломба наклейка круглая 20*20мм,google,['selectneo@mail.ru'],"['+375173850693', '+375173992015', '+375296762674', '+375296767474']",2025-09-18T13:57:31.547123
3,этикетка купить,https://vestorg.by,"Торговые весы CAS CL3000-B с памятью товаров и Ethernet, нержавеющая сталь с печатью этикеток купить в Минске у поставщика весового оборудования ""Взвешенное ...",google,['info@vestorg.by'],"['+375173654333', '+375445069261', '+375445669263']",2025-09-18T13:57:31.547128
3,этикетка купить,https://detmir.by,Наклейки по цене от 2 руб. до 39 руб. в интернет-магазине Детмир ✔️ В наличии 272 товара ✔️ Акции и скидки на наклейки ✔️ Быстрая доставка в Минск и по всей ...,google,['info@detmir.by'],"['+375173970001', '+74957810808', '+78613528320']",2025-09-18T13:57:31.547137
3,этикетка купить,https://gpsystems.by,"Купить автоматический принтер аппликатор этикеток. Выгодные цены на оборудование для нанесения этикеток. Сервисное обслуживание, гарантия.",google,['info@gpsystems.by'],"['+375173973574', '+375296065338', '+375296522936', '+73433102029', '+73833622796', '+74956627004', '+74956627006', '+78123311696', '+78632732086', '+79875480007']",2025-09-18T13:57:31.547142
3,этикетка купить,https://pl-shop.by,Купить садовые этикетки оптом и в розницу. Доставка по Беларуси. Скидки постоянным клиентам. Низкие цены на садовые этикетки в PL-Shop.by.,google,['info@pl-shop.by'],"['+375173969919', '+375296597655', '+375297680334']",2025-09-18T13:57:31.547148
3,этикетка купить,https://ofispremier.by,"Покупайте блоки клейкие, закладки, стикеры в интернет-магазине ОФИСПРЕМЬЕР. ⭐Большой ассортимент. ⭐Быстрая доставка по Минску и Беларуси. ⭐Оптовые цены.",google,['3351010@mail.ru'],"['+375172302383', '+375172302512', '+375333351010', '+375445351010']",2025-09-18T13:57:31.547154
3,этикетка купить,https://bez-granits.by,"Тактильные наклейки на поручни, 30х150 мм ... Возможно изготовление тактильных наклеек любого размера, цвета и текста. Уточняйте цены по телефону: 8 (033) 99-11 ...",google,['sales@bez-granits.by'],"['+375339043043', '+375339911000']",2025-09-18T13:57:31.547157
3,этикетка купить,https://tm.by,Очистители для скотча/наклеек ; 884616. BIBICARE · BIBICARE. Артикул производителя. 4404 ; 628377. REXANT · REXANT. Артикул производителя. 85-0004 ; 630393. LAVR.,google,['info@tm.by'],"['+375173169699', '+375256689699', '+375259659699', '+375293659699', '+375296689699', '+375333659699', '+375336689699']",2025-09-18T13:57:31.547161
3,этикетка купить,https://3ceni.by,"Продажа канцелярских товаров для офиса и творчества в Беларуси недорого. Цены, фото - Сеть магазинов ""Три цены""",google,"['anti-corruption@3ceni.by', 'info@3ceni.by']",['+375291556572'],2025-09-18T13:57:31.547172
3,этикетка купить,https://gala-mart.by,"Открытки, конверты и наклейки · Открытка поздравительная, бумага, 12,6х18,4/12,6х18,5 · Конверт для денег бумажный, 17х8см, 30 дизайнов · Fntastic Набор наклеек ...",google,['sale@galamart.ru'],"['+375295001016', '+73889822938', '+74720573945', '+78154322828', '+78310044188', '+78567259395', '+78698951037', '+79160374299', '+79246168424', '+79577523098', '+79602893707', '+79661052823', '+79686780559', '+79827300611', '+79961752343']",2025-09-18T13:57:31.547175
3,этикетка купить,https://pandaprint.by,Наклейки купить в Минске можно по низким ценам. Наборы наклеек легко заказать оптом и в розницу с доставкой по Беларуси в каталоге интернет-магазина ...,google,['6055969@mail.ru'],"['+375291207722', '+375291250077', '+375297122267', '+375445972207']",2025-09-18T13:57:31.547182
3,этикетка купить,https://elos-by.com,"Заказать таблички, книги, наклейки в Минске по выгодным условиям. ✓ Отличная цена на таблички, книги, наклейки в интернет-магазине Elos-by.com.",google,['elos@mail.ru'],"['+375173434670', '+375173509956', '+375447528208', '+79486249920']",2025-09-18T13:57:31.547186
3,этикетка купить,https://www.pos.by,"У нас всегда в наличии этикетки самых разных размеров. Самоклеящиеся этикетки подходят для оборудования брендов: TSC, Gainscha, DBS, HPRT, GPrinter, Honeywell, ...",google,['info@pos.by'],"['+375172570303', '+375172579199', '+375173881616', '+375296013020', '+375298350295']",2025-09-18T22:52:03.114950
3,этикетка купить,https://unimark.by,Металлизированные самоклеющиеся этикетки · Белые этикетки из полиэстера · Цветные этикетки из полиэстера · Этикетки с усиленным адгезивом · Высокотемпературные ...,google,['info@unimark.by'],"['+375172504545', '+375295583030', '+375445583030']",2025-09-18T22:52:03.114969
3,этикетка купить,https://shop-belblank.by,"В каталоге широкий выбор самоклеящейся бумаги, этикеток и ценников. ✓ для принтеров и копировальных аппаратов ✓ для этикет-пистолетов ✓ для маркировки ...",google,['buy@belblanc.by'],"['+375172151465', '+375173006722', '+375445550568']",2025-09-18T22:52:03.114971
3,этикетка купить,https://yudway.by,"Стандартными принято считать такие размеры, как: 58*30, 58*40, 58*60, 45*25, 100*80. Такая этикетка из материала термоЭко как правило есть в наличии на складе ...",google,"['//office@yudway.by', 'office@yudway.by']","['+375173360464', '+375173360465', '+375296666489', '+375336666492', '+375336666497']",2025-09-18T22:52:03.114973
3,этикетка купить,https://amway-shop.by,"Дозаторы, емкости и этикетки Amway. Все необходимые приспособления для продукции Amway - от мерного колпачка до пистолета-распылителя. Выгодно и удобно.",google,['info@amway-shop.by'],['+375293371121'],2025-09-18T22:52:03.114974
3,этикетка купить,https://vormatic.by,"Возможности ... Розн. 705 руб. Опт. 639 руб. Итого. 705 руб. ... Защитные антикражные этикетки — противокражные плоские наклейки небольших размеров, выполненные ...",google,['sale@vormatic.ru'],['+79601183838'],2025-09-18T22:52:03.114976
3,этикетка купить,https://ronex.by,"Весы торговые с печатью этикеток в продаже в компании Мераник. Цены от 1292 рублей. Сервисный центр, доставка и самовывоз. Фильтр. Цена. 1463. 3890. 6317. 8744.",google,"['info@ronex.by', 'zakaz@ronex.by']","['+375173970773', '+375293187526', '+375293887575', '+74951234567']",2025-09-18T22:52:03.114977
3,этикетка купить,https://xn--b1aaeeabb0hpc6ae.xn--90ais,Весы с печатью этикеток. Многое в наличии. Удобный сайт ▶︎ Скидки юридическим лицам до 20%. Отгружаем в день заказа. Доставка по всей Беларуси. Эксперты в ...,google,['sales@1vesovoy.by'],"['+375173880717', '+74997556597']",2025-09-18T22:52:03.114979
3,этикетка купить,https://www.officeton.by,"Купить Самоклеящиеся этикетки оптом в интернет-магазине Офистон. Оплата по безналичному расчёту с доставкой по Минску и Минской области — Солигорск, Жодино, ...",google,['info@officeton.by'],"['+375173885959', '+375333182182', '+375445182182']",2025-09-18T22:52:03.114981
3,этикетка купить,https://astrajet.by,Нужен принтер этикеток? Астраджет предлагает принтер для печати этикеток ✔️ для маркетплейсов купить с доставкой по Беларуси и России ⭐ с расширенной ...,google,['mail@astrajet.by'],"['+375445253262', '+375447882462', '+375447882532']",2025-09-18T22:52:03.114983
3,этикетка купить,https://www.vlgroup.by,"Печать и изготовление наклеек в Минске. Заказать этикетки любой формы и размера, подрезка по контуру, сквозная прорезка. Купить самоклеящиеся этикетки.",google,['vlgroup@yandex.ru'],"['+375172250090', '+375172251960', '+375172256577', '+375172257017', '+375293877017', '+375295777017']",2025-09-18T22:52:03.114984
3,этикетка купить,https://selectneo.by,Пломба наклейка 60*20мм/ с оставлением следа. Цена: 0.12 р. (шт.) Подробнее. ﻿. Пломба наклейка круглая 20*20мм. Пломба наклейка круглая 20*20мм,google,['selectneo@mail.ru'],"['+375173850693', '+375173992015', '+375296762674', '+375296767474']",2025-09-18T22:52:03.114986
3,этикетка купить,https://vestorg.by,"Торговые весы CAS CL3000-B с памятью товаров и Ethernet, нержавеющая сталь с печатью этикеток купить в Минске у поставщика весового оборудования ""Взвешенное ...",google,['info@vestorg.by'],"['+375173654333', '+375445069261', '+375445669263']",2025-09-18T22:52:03.114987
3,этикетка купить,https://detmir.by,Наклейки по цене от 1 руб. до 39 руб. в интернет-магазине Детмир ✔️ В наличии 358 товаров ✔️ Акции и скидки на наклейки ✔️ Быстрая доставка в Минск и по всей ...,google,['info@detmir.by'],"['+375173970001', '+74957810808', '+78613528320', '+79148748692']",2025-09-18T22:52:03.114990
3,этикетка купить,https://gpsystems.by,"Купить автоматический принтер аппликатор этикеток. Выгодные цены на оборудование для нанесения этикеток. Сервисное обслуживание, гарантия.",google,['info@gpsystems.by'],"['+375173973574', '+375296065338', '+375296522936', '+73433102029', '+73833622796', '+74956627004', '+74956627006', '+78123311696', '+78632732086', '+79875480007']",2025-09-18T22:52:03.114991
3,этикетка купить,https://pl-shop.by,Купить садовые этикетки оптом и в розницу. Доставка по Беларуси. Скидки постоянным клиентам. Низкие цены на садовые этикетки в PL-Shop.by.,google,['info@pl-shop.by'],"['+375173969919', '+375296597655', '+375297680334']",2025-09-18T22:52:03.114993
3,этикетка купить,https://ofispremier.by,"Покупайте блоки клейкие, закладки, стикеры в интернет-магазине ОФИСПРЕМЬЕР. ⭐Большой ассортимент. ⭐Быстрая доставка по Минску и Беларуси. ⭐Оптовые цены.",google,['3351010@mail.ru'],"['+375172302383', '+375172302512', '+375333351010', '+375445351010']",2025-09-18T22:52:03.114994
3,этикетка купить,https://bez-granits.by,"Тактильные наклейки на поручни, 30х150 мм ... Возможно изготовление тактильных наклеек любого размера, цвета и текста. Уточняйте цены по телефону: 8 (033) 99-11 ...",google,['sales@bez-granits.by'],"['+375339043043', '+375339911000']",2025-09-18T22:52:03.114996
