user_id,query,region,domain,description,engine,emails,phones,dateOfSearch
3,купить саженцы Гродно -site:wildberries.ru -site:ozon.ru -site:kufar.by -site:21vek.by -site:5element.by -site:masterdom.by -site:officeton.by -site:irecommend.ru -site:777555.by -site:dzen.ru -site:factories.by -site:equipnet.ru -site:sitmag.ru -site:rutube.ru -site:openbusiness.ru -site:emall.by -site:7745.by -site:auto.kufar.by,by,https://augustgreen.by,Verbena bonariensis Растения собственного производства ⭐️Гарантия сортового соответствия Эффектное растение с обильным и очень продолжительным цветением.,google,['info@augustgreen.by'],"['+375293626360', '+375297851486', '+375298107764', '+375333526360', '+375447107764']",15-10-2025 11:26:43
3,купить саженцы Гродно -site:wildberries.ru -site:ozon.ru -site:kufar.by -site:21vek.by -site:5element.by -site:masterdom.by -site:officeton.by -site:irecommend.ru -site:777555.by -site:dzen.ru -site:factories.by -site:equipnet.ru -site:sitmag.ru -site:rutube.ru -site:openbusiness.ru -site:emall.by -site:7745.by -site:auto.kufar.by,by,https://taka.by,Минске легко купить любое цитрусовое растение с плодами в подарочной упаковке с доставкой по Беларуси. Этот роскошный живой букет будет продолжать плодоносить ...,google,['takaby2015@gmail.com'],"['+375259606411', '+375296606411']",15-10-2025 11:26:43
3,купить саженцы Гродно -site:wildberries.ru -site:ozon.ru -site:kufar.by -site:21vek.by -site:5element.by -site:masterdom.by -site:officeton.by -site:irecommend.ru -site:777555.by -site:dzen.ru -site:factories.by -site:equipnet.ru -site:sitmag.ru -site:rutube.ru -site:openbusiness.ru -site:emall.by -site:7745.by -site:auto.kufar.by,by,https://dolinasad.by,"Саженцы Лавровишни и других декоративных кустарников и деревьев купить в Беларуси⭐ Доступные цены, широкий ассортимент растений, гарантия качества!",google,"['info@dolinasad.by', 'optdolinasad@mail.ru']","['+375255498681', '+375296255011', '+375333255011']",15-10-2025 11:26:43
3,купить саженцы Гродно,164,https://yandex.ru,"Acrocona.by (Индурское ш., 30, Гродно), магазин для садоводов в Гродно.",yandex,"['dzen-pro-bv-stella@3x.png', 'modal-emoji-left@3x.png', 'modal-emoji-right@3x.png', 'modal-emoji@3x.png']",[],15-10-2025 11:26:43
3,купить саженцы Гродно,164,https://1pitomnik.by,"Доставка саженцев по Беларуси в Минск, Витебск, Гродно, Гомель, Могилев, Брест и другие крупные города осуществляется Белпочтой или Европочтой. Вы можете выбрать наиболее удобный вам способ. Если вы проживаете в мелких населенных пунктах - посылки мы отправим в ближайшее к вам почтовое отделение.",yandex,['office@divsad.by'],"['+375298412160', '+79652225297']",15-10-2025 11:26:43
3,купить саженцы Гродно,164,https://gzir.by,,yandex,['info@gzir.by'],['+375151420687'],15-10-2025 11:26:43
3,купить саженцы Гродно,164,https://acrocona.by,acrocona@list.ru. +375 29 2855415. Садовый центр в Гродно! Главная. Каталог.,yandex,['acrocona@list.ru'],['+375292855415'],15-10-2025 11:26:43
3,купить саженцы Гродно,164,https://divsad.by,Наша компания занимается выращиванием и продажей растений с 2005 года.,yandex,['office@divsad.by'],"['+375298412160', '+375333700764']",15-10-2025 11:26:43
3,купить саженцы Гродно,164,https://divsadby.ru,"Доставка саженцев по Беларуси в Минск, Витебск, Гродно, Гомель, Могилев, Брест и другие крупные города осуществляется Белпочтой или Европочтой. Вы можете выбрать наиболее удобный вам способ. Если вы проживаете в мелких населенных пунктах - посылки мы отправим в ближайшее к вам почтовое отделение.",yandex,['office@divsad.by'],"['+375298412160', '+79652225297']",15-10-2025 11:26:43
3,купить саженцы Гродно,164,https://greenfam.by,"Каталог декоративных растений, саженцев растений, цветов, деревьев из лучших европейских питомников, с доставкой по всей Беларуси по лучшим ценам, для вашего сада магазины в Лиде и Барановичах, работаем с доставкой по всей Беларуси.",yandex,['baranovskaya-vikulya@mail.ru'],"['+375445977333', '+73414775151', '+73428925188', '+73512352552', '+73650624181', '+73813868473', '+73854087514', '+73946638221', '+74271353663']",15-10-2025 11:26:43
3,купить саженцы Гродно,164,https://yaspravka.com,,yandex,"['reklama@yaspravka.com', 'support@yaspravka.com']",[],15-10-2025 11:26:43
3,купить саженцы Гродно,164,https://mirsada.by,Саженцы Сливы колоновидной.,yandex,['mirsada@tut.by'],"['+375256265160', '+375257870070', '+375296365427', '+375296538823', '+375445510005', '+79145167415']",15-10-2025 11:26:43
