user_id,query,domain,description,engine,emails,phones,dateOfSearch
1,картон купить,https://mamont.by,"Купить картон укрывочный в Минске в интернет-магазине. Доставка по Минску и Беларуси, рассрочка по картам, низкие цены.",google,"['z@mamont.by', 'zakup@mamont.by']","['+375173881504', '+375257504504', '+375293504504', '+375333504504', '+375445016003']",03-09-2025 10:35:24
1,картон купить,https://www.postroyka.by,"Картон укрывочный, плёнка ... 1,96 руб./шт. ... Плёнка Тепличная 120 мкм ГОСТ. Ширина 3 м (рукав 1,5 м) · Плёнка Тепличная 120 мкм ГОСТ. Ширина 3 м (рукав 1,5 м).",google,['mail@postroyka.by'],"['+375172151465', '+375172151740', '+375172152626', '+375173600118', '+375296115959', '+375296285959', '+375296585959', '+375296595959', '+375296795959', '+375296835959', '+375336115959', '+375336285959', '+375336585959', '+375336595959', '+375336795959', '+375336835959']",03-09-2025 10:35:24
1,картон купить,https://woodfuel.by,"52 руб. шт. - +. Базальтовый картон фольгированный ""Rockwool"" 30мм. Добавить в корзину. В наличии. Вата базальтовая 3кг Вата базальтовая 3кг. 30 руб. мешок. - +.",google,['1757575@tut.by'],[],03-09-2025 10:35:24
1,картон купить,https://leonardohobby.by,"Подборки ... 4.62 р. ""Лео"" ""Учись"" Картон белый, мелованный LNWCB-01 200 г/м2 A4 21 х 29.7 см 8 л. 1 цв. . ... 4.97 р. ""Лео"" ""Учись"" Картон цветной, мелованный ...",google,['shop-rb@leonardohobby.by'],['+375172709053'],03-09-2025 10:35:24
1,картон купить,https://artterritory.by,"Купить бумага и картон по выгодным ценам в интернет-магазине АртТерритория ✨ Более 20 000 товаров для творчества, рисования и рукоделия по выгодным ценам ...",google,['sale@art-t.by'],"['+375162484593', '+375172151740', '+375172152626', '+375336591004', '+375447177037']",03-09-2025 10:35:24
1,картон купить,https://detmir.by,Цветная бумага и картон по цене от 1 руб. до 13 руб. в интернет-магазине Детмир ✔️ В наличии 79 товаров ✔️ Акции и скидки на цветную бумагу и картон ✔️ Быстрая ...,google,['info@detmir.by'],"['+375173181333', '+375173771393', '+375173970001']",03-09-2025 10:35:24
1,картон купить,https://papercom.by,Картон полиграфический по наличному или безналичному расчету от Бумажной компании. Доставка по Минску и Беларуси.,google,['info@papercom.by'],"['+375173882042', '+375297620808', '+375447620808']",03-09-2025 10:35:24
1,картон купить,https://3ceni.by,Картон ... 2.19 руб. 2.47 руб. ... Экономия 0.28 руб. ... 1.99 руб. 2.31 руб. ... Экономия 0.32 руб. ... 2.19 руб. 2.29 руб. ... Экономия 0.10 руб. ... 2.19 руб. 2.61 руб.,google,"['anti-corruption@3ceni.by', 'info@3ceni.by']",['+375291556572'],03-09-2025 10:35:24
1,картон купить,https://www.officeton.by,Купить наборы цветной бумаги и картона оптом в интернет-магазине Офистон. Оплата по безналичному расчёту с доставкой по Минску и Минской области — Солигорск ...,google,['info@officeton.by'],"['+375173885959', '+375333182182', '+375445182182']",03-09-2025 10:35:24
1,картон купить,https://mastac.by,"Плита БВТМ-К-1250х600х10 (картон базальтовый). Цена: 9,67 руб. В наличии. Location: - Выбор города -, Березино - В наличии, Борисов ...",google,['you@example.com'],"['+375175165240', '+375223531149', '+375256951313', '+375256951717', '+375291011076', '+375291130299', '+375291317261', '+375291517711', '+375293403000', '+375293790101', '+375293901011', '+375295533030', '+375295734000', '+375296124975', '+375296199594', '+375296507628', '+375296663480', '+375296663482', '+375296901177', '+375296951313', '+375296951717', '+375297550109', '+375297614000', '+375297957441', '+375298157972', '+375298373700', '+375333449090', '+375333790101', '+375336251020', '+375336951313', '+375336951717', '+375339921177', '+375445496908', '+375445570015', '+375445594338', '+375445734000', '+375445744888', '+375445842027', '+375447184219', '+375447363304', '+375447614000', '+375447707099', '+375447821914', '+375447984498']",03-09-2025 10:35:24
1,картон купить,https://treara.by,"Розничные цены · 20 - 100 листов - 3,95 руб3,3 руб за 1 лист c НДС · 100 - 300 листов - 3,7 руб3,0 руб за 1 лист c НДС · 300 - 600 листов - 3,43 руб2,8 руб за 1 ...",google,['info-treara@mail.ru'],['+375296018700'],03-09-2025 10:35:24
1,картон купить,https://pechnoi.by,"Огнеупорный картон удобно применять при строительстве каминов, печей, дымоходов и. т. д. Материал легко режется и принимает изогнутую форму. Часто применяется ...",google,['pechki2015@yandex.ru'],"['+375175256486', '+375291671242', '+375292786742']",03-09-2025 10:35:24
1,картон купить,https://ggn.by,"Мелованный трехслойный картон GC2 Standart предназначен для изготовления упаковки пищевой и непищевой продукции, канцелярско-бытовых товаров и полиграфии.",google,['ggn101000920@gmail.com'],"['+375173996895', '+375259487205', '+375291203042', '+375293283100', '+375293296488', '+375293831309', '+375296200702', '+375296265575']",03-09-2025 10:35:24
1,картон купить,https://partnerpack.by,"Упаковка из картона в «ПартнерПак» - интернет-гипермаркет упаковочных материалов, а также хозяйственных товаров. Быстрая доставка по Минску и Беларуси, ...",google,['info@partnerpack.by'],"['+375175016516', '+375293470783', '+375333470783']",03-09-2025 10:35:24
1,картон купить,https://www.oma.by,"Покупайте сразу, а платите потом. Удобные ежемесячные платежи. Халва. Карты рассрочки. Халва, Карта покупок, Черепаха, #wishня, КартаFUN, Красная карта ...",google,"['brak@oma.by', 'ooo@oma.by']","['+375172702914', '+375172703375', '+375173301000', '+375173301010', '+375447778203']",03-09-2025 10:35:24
1,картон купить,https://redpack.by,"Листовой картон ... 2.10 руб/л. Варианты цен. 2.10 руб/л. ... 4.60 руб/л. Варианты цен. 4.60 руб/л. ... Картон листовой удобен для упаковки товаров, амортизации слоев ...",google,['info@redpack.by'],['+375291072727'],03-09-2025 10:35:24
1,картон купить,https://bild-shop.by,"Фольга, базальтовый картон в Полоцке. ✓ Выгодные цены в интернет-магазине Bild. ✓ Доставка по Беларуси.",google,"['info@bild-shop.by', 'offers@bild-shop.by', 'orders@bild-shop.by']","['+375174237320', '+375174241515', '+375255456969', '+375291041740', '+375291132040', '+375291140061', '+375291190196', '+375291518500', '+375291608482', '+375291961986', '+375293796162', '+375295996969', '+375296788684', '+375445102902', '+375445221315', '+375445254414', '+375445356336', '+375445996969', '+375447121412', '+375447655536']",03-09-2025 10:35:24
1,картон купить,https://pandaprint.by,Купить крафт картон в Минске оптом по низким ценам в интернет-магазине производителя упаковочных материалов PandaPrint. Продажа крафтового картона оптом и в ...,google,['6055969@mail.ru'],"['+375291207722', '+375291250077', '+375297122267', '+375445972207']",03-09-2025 10:35:24
1,картон купить,https://skladna.by,"Купить Картон гофрированный трехслойный ТБ 1050х2070 мм можно с доставкой в г. Гомель и по всей Беларуси. Пункт самовывоза по адресу: Беларусь, г. Гомель проезд ...",google,['minsk@skladna.by'],"['+375173368404', '+375291116677']",03-09-2025 10:35:24
1,картон купить,https://xn--80afgmoekd7gtb.xn--90ais,Асбестовый картон КАОН 1 – это плотный волокнистый материал обширного назначения. Производится на заводе в форме листов (размер листа 800×1000 мм). Он устойчив ...,google,['gomelshina-roz@mail.ru'],"['+375232347735', '+375232915686', '+375291162387', '+375291162389', '+375293050137', '+375293487218', '+375445616166', '+375447640566', '+375447991318']",03-09-2025 10:35:24
1,картон купить,https://100kaminov.by,"Aug 18, 2025 ... Базальтовый картон 1250х600х5мм. В наличии. 9 руб. Купить. Базальтовый картон 1250х600х10мм 157219934. Базальтовый картон 1250х600х10мм.",google,['100kaminov@gmail.com'],['+375296570902'],03-09-2025 10:35:24
1,картон купить,https://www.pnevmoteh.by,Упаковочные степлеры в каталоге Pnevmoteh.by Выгодные цены Рассрочка до 12 месяцев Доставка по всей Беларуси ➤ Звоните!,google,['info@pnevmoteh.by'],"['+375172151465', '+375172152626', '+375173027887', '+375293547887', '+375333547887']",03-09-2025 10:35:24
1,картон купить,https://gms-pack.by,"Шоубокс из белого картона от компании ГМС-ПАК. Доставка в Минске и РБ. Заказывайте оптом изделие ""Шоубокс из белого картона"": ☎ 375 (29) 357-01-52.",google,['info@gms-pack.by'],"['+375291686168', '+375291737956', '+375293570152', '+375296720136', '+375447686164']",03-09-2025 10:35:24
1,картон купить,https://bumcom.by,"Папки картонные, скоросшиватели по наличному или безналичному расчету от Бумажной компании. Доставка по Минску и Беларуси.",google,['info@bumcom.by'],"['+375173882045', '+375173882046', '+375297620808', '+375447620808']",03-09-2025 10:35:24
1,картон купить,https://e-moroz.by,"Мороженое сливочное маракуйя и ананас «FRUDOZA» стакан картон, 150 г купить в Минске с доставкой до дома ✓ Выгодные цены в интернет-магазине Морозпродукт ...",google,"['emoroz@moroz.by', 'moroz@e-moroz.by']","['+375173733797', '+375293003797', '+375333003797']",03-09-2025 10:35:24
1,картон купить,https://belbumtorg.by,"У нас можно купить картон для коробок или как его называют упаковочный картон или коробочный, предназначен для изготовления упаковок. В продаже есть ...",google,['belbumtorg@mail.ru'],"['+375173736597', '+375293243767']",03-09-2025 10:35:24
1,картон купить,https://www.21vek.by,"Базальтовый картон фольгированный - 21vek.by ⭐️ Доставка в Минске и по регионам Беларуси, самовывоз ✓ Наличная и безналичная оплата ✓ Рассрочка.",google,"['21@21vek.by', '904d288bb569f6824db506fe77f55bd0@sentry.21vek.by']","['+375173021021', '+375173740146', '+375255021021', '+375293021021']",03-09-2025 10:35:24
1,картон купить,https://fsu.by,"Гофрированный картон оптом по выгодной цене, производим листовой гофрокартон - двухслойный, трехслойный и пятислойный. Доставка по Беларуси (Минск, Витебск, ...",google,"['info@fsu.by', 'sales@fsu.by']","['+375212365638', '+375212675855']",03-09-2025 10:35:24
1,картон купить,https://borisov-praktik.by,Базальтовый картон фольгированный (плита БВТМ-К-Ф1) 1250*600*10 (Россия) · Описание · Как купить · Оплата · Доставка · Задать вопрос · Дополнительно.,google,['info@borisov-praktik.by'],"['+375177746565', '+375256979494', '+375296979494', '+375336979494']",03-09-2025 10:35:24
1,картон купить,https://arlight.by,"Заказать в интернет-магазине: тубус картонный arl-120х3х2050 (с крышкой) (arlight, картон) от компании Arlight с ценами и подробной информацией о товаре.",google,"['5075046@arlight.pro', 'info@arlight.pro']",['+375173887873'],03-09-2025 10:35:24
