user_id,query,domain,description,engine,position,emails,phones,dateOfSearch
3,картон купить,https://mamont.by,"Купить картон укрывочный в Минске в интернет-магазине. Доставка по Минску и Беларуси, рассрочка по картам, низкие цены.",google,999,"['z@mamont.by', 'zakup@mamont.by']","['+375173881504', '+375257504504', '+375293504504', '+375333504504', '+375445016003']",11-09-2025 22:58:05
3,картон купить,https://www.postroyka.by,"Картон укрывочный, плёнка ... 1,96 руб./шт. ... Плёнка Тепличная 120 мкм ГОСТ, ширина 3 м (рукав 1,5 м) · Плёнка Тепличная 120 мкм ГОСТ, ширина 3 м (рукав 1,5 м), ...",google,999,['mail@postroyka.by'],"['+375172151465', '+375172151740', '+375172152626', '+375173600118', '+375296115959', '+375296285959', '+375296585959', '+375296595959', '+375296795959', '+375296835959', '+375336115959', '+375336285959', '+375336585959', '+375336595959', '+375336795959', '+375336835959']",11-09-2025 22:58:05
3,картон купить,https://woodfuel.by,Базальтовый картон можно приобрести в интернет-магазине Woodfuel! ✓ Отличные цены на базальтовый картон ✓ Доставка или самовывоз ✓ Акции и скидки ...,google,999,['a73030@yandex.by'],[],11-09-2025 22:58:05
3,картон купить,https://artterritory.by,"Купить бумага и картон по выгодным ценам в интернет-магазине АртТерритория ✨ Более 20 000 товаров для творчества, рисования и рукоделия по выгодным ценам ...",google,999,['sale@art-t.by'],"['+375162484593', '+375172151740', '+375172152626']",11-09-2025 22:58:05
3,картон купить,https://leonardohobby.by,"Подборки ... 4.62 р. ""Лео"" ""Учись"" Картон белый, мелованный LNWCB-01 200 г/м2 A4 21 х 29.7 см 8 л. 1 цв. . ... 4.97 р. ""Лео"" ""Учись"" Картон цветной, мелованный ...",google,999,['shop-rb@leonardohobby.by'],['+375172709053'],11-09-2025 22:58:05
3,картон купить,https://ksk.by,Категории · Базальтовый картон БВТМ-К 1250x600x10 мм · Базальтовый картон фольгированный БВТМ-К-Ф1 1250x600x10 мм · Базальтовый картон БВТМ-К 1250x600x5 мм.,google,999,['info@ksk.by'],"['+375232241985', '+375232242466', '+375232347735', '+375445252694', '+375445252695', '+375445252696', '+375447462222']",11-09-2025 22:58:05
3,картон купить,https://detmir.by,Цветная бумага и картон по цене от 1 руб. до 14 руб. в интернет-магазине Детмир ✔️ В наличии 80 товаров ✔️ Акции и скидки на цветную бумагу и картон ✔️ Быстрая ...,google,999,"['corp@detmir.ru', 'info@detmir.by', 'u003ecorp@detmir.ru']","['+375173181333', '+375173771393', '+375173970001']",11-09-2025 22:58:05
3,картон купить,https://papercom.by,"Картон переплётный · Картон обложечный Пролетарий, 1100г/м2, 700х1000х1,75мм · Картон обложечный Пролетарий, 1250г/м2, 700х1000х2мм · Картон обложечный ...",google,999,['info@papercom.by'],"['+375173882042', '+375297620808', '+375447620808']",11-09-2025 22:58:05
3,картон купить,https://gemma.by,Картон гофрированный 7223 Т-22 С 2000*1000 мм · 0.60 руб/шт · 217 шт · шт. Бесплатная доставка из интернет-магазина от 250 рублей. Гибкая программа лояльности ...,google,999,"['info@gemma.by', 'pavel.sabenin@gemma.by', 'svetlana@gemma.by']","['+375152626944', '+375152795835', '+375295132207', '+375336874236', '+375447870089']",11-09-2025 22:58:05
3,картон купить,https://www.officeton.by,Купить наборы цветной бумаги и картона оптом в интернет-магазине Офистон. Оплата по безналичному расчёту с доставкой по Минску и Минской области — Солигорск ...,google,999,"['albina.dvorokovskaya@officeton.by', 'anastasia.stoma@officeton.by', 'anastasiya.belenkaya@officeton.by', 'anastasiya.bezmen@officeton.by', 'andrey.anukevich@officeton.by', 'arina.vasilieva@officeton.by', 'bobr@officeton.by', 'brest@officeton.by', 'darya.ilina@officeton.by', 'darya.mihalenko@officeton.by', 'denis.ribachuk@officeton.by', 'ekaterina.oleinik@officeton.by', 'elena.marina@officeton.by', 'gomel@officeton.by', 'grodno@officeton.by', 'info@officeton.by', 'irina.polyakova@officeton.by', 'irina.prohorova@officeton.by', 'irina.snarskaya@officeton.by', 'margarita.sigalova@officeton.by', 'maria.nichiporuk@officeton.by', 'marina.butko@smarton.by', 'mogilev@officeton.by', 'mozyr@officeton.by', 'natalia.aplevich@officeton.by', 'natalia.medveckaya@officeton.by', 'natalia.protskaya@officeton.by', 'nataly.tyr@officeton.by', 'natalya.kurik@officeton.by', 'oksana.karunos@officeton.by', 'olga.astashenok@officeton.by', 'raisa.terenya@officeton.by', 'sales-dm@officetonmarket.by', 'sales-kd@officetonmarket.by', 'sales-mogilev@officetonmarket.by', 'sales-pritytskogo@officetonmarket.by', 'sales-surganova@officetonmarket.by', 'shkurina@officeton.by', 'svetlana.medveckaya@officeton.by', 'tamara.dehtevich@officeton.by', 'tatyana.bahtiyarova@officeton.by', 'tatyana.petrovich@officeton.by', 'vadim.andreev@officeton.by', 'valentina.kuchkovskaya@officeton.by', 'veronika.ban@officeton.by', 'viktoriya.lapickaya@officeton.by', 'vitebsk@officeton.by', 'yana.proskushkina@officeton.by', 'yuliya.shumaher@officeton.by', 'yuliya.zayats@officeton.by']","['+375152623520', '+375152623521', '+375162217219', '+375162342799', '+375162531200', '+375173885910', '+375173885938', '+375173885939', '+375173885940', '+375173885956', '+375173885958', '+375173885959', '+375173885990', '+375212602523', '+375222773334', '+375222773335', '+375222773508', '+375222773561', '+375225742000', '+375225743000', '+375232212076', '+375232212238', '+375232223349', '+375232235801', '+375236203164', '+375236204599', '+375236206025', '+375291202695', '+375291385910', '+375291801179', '+375291820109', '+375291820136', '+375291820205', '+375291820309', '+375291820313', '+375291820401', '+375291820535', '+375291820550', '+375291820604', '+375291820633', '+375291977364', '+375292814948', '+375293072300', '+375295931722', '+375296753562', '+375296753563', '+375296753580', '+375297470750', '+375298655585', '+375333182182', '+375445182182', '+375447343412', '+375447343416', '+375447343495', '+375447746214', '+3758011009182', '+79999999999']",11-09-2025 22:58:05
3,картон купить,https://mastac.by,"Плита БВТМ-К-1250х600х10 (картон базальтовый). Цена: 9,67 руб. В наличии. Location: - Выбор города -, Березино - В наличии, Борисов ...",google,999,['you@example.com'],"['+375175165240', '+375223531149', '+375256951313', '+375256951717', '+375291011076', '+375291130299', '+375291317261', '+375291517711', '+375293403000', '+375293790101', '+375293901011', '+375295533030', '+375295734000', '+375296124975', '+375296199594', '+375296507628', '+375296663480', '+375296663482', '+375296901177', '+375296951313', '+375296951717', '+375297550109', '+375297614000', '+375297957441', '+375298157972', '+375298373700', '+375333449090', '+375333790101', '+375336251020', '+375336951313', '+375336951717', '+375339921177', '+375445496908', '+375445570015', '+375445594338', '+375445734000', '+375445744888', '+375445842027', '+375447184219', '+375447363304', '+375447614000', '+375447707099', '+375447821914', '+375447984498']",11-09-2025 22:58:05
3,картон купить,https://bobrujsk-praktik.by,Можно купить в интернет-магазине Практик. Базальтовый картон ОБМ-К-Ф 10 мм (1000х600 мм) по выгодной цене. Есть рассрочка и бесплатная доставка.,google,999,['info@bobrujsk-praktik.by'],"['+375225708808', '+375225708908', '+375225726256', '+375291053338', '+375333778809', '+375445778808']",11-09-2025 22:58:05
3,картон купить,https://3ceni.by,Картон ... 2.19 руб. 2.47 руб. ... Экономия 0.28 руб. ... 1.99 руб. 2.31 руб. ... Экономия 0.32 руб. ... 2.19 руб. 2.29 руб. ... Экономия 0.10 руб. ... 2.19 руб. 2.61 руб.,google,999,"['anti-corruption@3ceni.by', 'info@3ceni.by']",['+375291556572'],11-09-2025 22:58:05
3,картон купить,https://treara.by,"Розничные цены · 20 - 100 листов - 3,95 руб3,3 руб за 1 лист c НДС · 100 - 300 листов - 3,7 руб3,0 руб за 1 лист c НДС · 300 - 600 листов - 3,43 руб2,8 руб за 1 ...",google,999,['info-treara@mail.ru'],['+375296018700'],11-09-2025 22:58:05
3,картон купить,https://bild-shop.by,"45,49 руб. В корзину. Фольга 50мкр 12м2 арт.016982. Фольга 50мкр 12м2 арт.016982. 50,9 руб. В корзину. Фольга алюм,50мкр ...",google,999,"['info@bild-shop.by', 'offers@bild-shop.by', 'orders@bild-shop.by']","['+375174237320', '+375174241515', '+375255456969', '+375291041740', '+375291132040', '+375291140061', '+375291190196', '+375291518500', '+375291608482', '+375291961986', '+375293796162', '+375295996969', '+375296788684', '+375445102902', '+375445221315', '+375445254414', '+375445356336', '+375445996969', '+375447121412', '+375447655536']",11-09-2025 22:58:05
3,картон купить,https://redpack.by,"Листовой картон ... 2.10 руб/л. Варианты цен. 2.10 руб/л. ... 4.60 руб/л. Варианты цен. 4.60 руб/л. ... Картон листовой удобен для упаковки товаров, амортизации слоев ...",google,999,['info@redpack.by'],['+375291072727'],11-09-2025 22:58:05
3,картон купить,https://partnerpack.by,"Упаковка из картона в «ПартнерПак» - интернет-гипермаркет упаковочных материалов, а также хозяйственных товаров. Быстрая доставка по Минску и Беларуси, ...",google,999,['info@partnerpack.by'],"['+375175016516', '+375293470783', '+375333470783']",11-09-2025 22:58:05
3,картон купить,https://www.oma.by,"Покупайте сразу, а платите потом. Удобные ежемесячные платежи. Халва. Карты рассрочки. Халва, Карта покупок, Черепаха, #wishня, КартаFUN, Красная карта ...",google,999,"['brak@oma.by', 'ooo@oma.by']","['+375172702914', '+375172703375', '+375173301000', '+375173301010', '+375447778203']",11-09-2025 22:58:05
3,картон купить,https://ggn.by,"Мелованный трехслойный картон GC2 Standart предназначен для изготовления упаковки пищевой и непищевой продукции, канцелярско-бытовых товаров и полиграфии.",google,999,['ggn101000920@gmail.com'],"['+375173996895', '+375259487205', '+375291203042', '+375293283100', '+375293296488', '+375293831309', '+375296200702', '+375296265575']",11-09-2025 22:58:05
3,картон купить,https://pechnoi.by,"Базальтовый картон – Огнеупорный картон относительно жесткий, изготавливается из базальтового супертонкого волокна. Бентонитовая глина, используется как ...",google,999,['pechki2015@yandex.ru'],"['+375175256486', '+375291671242', '+375292786742']",11-09-2025 22:58:05
3,картон купить,https://pandaprint.by,Купить крафт картон в Минске оптом по низким ценам в интернет-магазине производителя упаковочных материалов PandaPrint. Продажа крафтового картона оптом и в ...,google,999,['6055969@mail.ru'],"['+375291207722', '+375291250077', '+375297122267', '+375445972207']",11-09-2025 22:58:05
3,картон купить,https://www.pnevmoteh.by,Упаковочные степлеры в каталоге Pnevmoteh.by Выгодные цены Рассрочка до 12 месяцев Доставка по всей Беларуси ➤ Звоните!,google,999,['info@pnevmoteh.by'],"['+375172151465', '+375172152626', '+375173027887', '+375293547887', '+375333547887']",11-09-2025 22:58:05
3,картон купить,https://mile.by,"Картон гофрированный трёхслойный 1200x800mm, отлично подойдет для упаковки различной продукции, так и для напольного покрытия во время ремонта. Гофрокартон, как ...",google,999,"['cc@mile.by', 'dpo@mile.by', 'info@mile.by']","['+375173181333', '+375173608211', '+375173771393', '+375173881055', '+375296337722']",11-09-2025 22:58:05
3,картон купить,https://xn--80afgmoekd7gtb.xn--90ais,Асбестовый картон КАОН 1 – это плотный волокнистый материал обширного назначения. Производится на заводе в форме листов (размер листа 800×1000 мм). Он устойчив ...,google,999,['gomelshina-roz@mail.ru'],"['+375232347735', '+375232915686', '+375291162387', '+375291162389', '+375293050137', '+375293487218', '+375445616166', '+375447640566', '+375447991318']",11-09-2025 22:58:05
3,картон купить,https://100kaminov.by,Базальтовый картон 1250х600х5мм. В наличии. 9 руб. Купить. Базальтовый картон 1250х600х10мм 157219934. Базальтовый картон 1250х600х10мм. В наличии.,google,999,['100kaminov@gmail.com'],['+375296570902'],11-09-2025 22:58:05
3,картон купить,https://gms-pack.by,"Шоубокс из белого картона от компании ГМС-ПАК. Доставка в Минске и РБ. Заказывайте оптом изделие ""Шоубокс из белого картона"": ☎ 375 (29) 357-01-52.",google,999,['info@gms-pack.by'],"['+375291144197', '+375291686168', '+375291737956', '+375293570152', '+375296720136']",11-09-2025 22:58:05
3,картон купить,https://bumcom.by,"Папки картонные, скоросшиватели по наличному или безналичному расчету от Бумажной компании. Доставка по Минску и Беларуси.",google,999,['info@bumcom.by'],"['+375173882045', '+375173882046', '+375297620808', '+375447620808']",11-09-2025 22:58:05
3,картон купить,https://skladna.by,"Купить Картон гофрированный трехслойный ТБ 1050х2070 мм можно с доставкой в г. Гомель и по всей Беларуси. Пункт самовывоза по адресу: Беларусь, г. Гомель проезд ...",google,999,['minsk@skladna.by'],"['+375173368404', '+375291116677']",11-09-2025 22:58:05
3,картон купить,https://e-moroz.by,"Мороженое сливочное маракуйя и ананас «FRUDOZA» стакан картон, 150 г купить в Минске с доставкой до дома ✓ Выгодные цены в интернет-магазине Морозпродукт ...",google,999,"['emoroz@moroz.by', 'moroz@e-moroz.by']","['+375173733797', '+375293003797', '+375333003797']",11-09-2025 22:58:05
3,картон купить,https://belbumtorg.by,"У нас можно купить картон для коробок или как его называют упаковочный картон или коробочный, предназначен для изготовления упаковок. В продаже есть ...",google,999,['belbumtorg@mail.ru'],"['+375173736597', '+375293243767']",11-09-2025 22:58:05
3,картон купить,https://www.21vek.by,"Базальтовый картон фольгированный - 21vek.by ⭐️ Доставка в Минске и по регионам Беларуси, самовывоз ✓ Наличная и безналичная оплата ✓ Рассрочка.",google,999,"['21@21vek.by', '904d288bb569f6824db506fe77f55bd0@sentry.21vek.by']","['+375173021021', '+375173740146', '+375255021021', '+375293021021']",11-09-2025 22:58:05
3,картон купить,https://paperki.by,"Папки Дело, картонные скоросшиватели с доставкой по Бресту. ✓Доступные цены! ☏ 8-0162-57-60-60 Звоните и заказывайте в интернет-магазине Paperki.by!",google,999,"['paperki1@paperki.by', 'paperki2@paperki.by', 'paperki4@paperki.by', 'paperki5@paperki.by', 'paperki6@paperki.by', 'paperki7@paperki.by', 'paperki8@paperki.by']","['+375162251951', '+375162576060', '+375162586060', '+375162596060', '+375162937692', '+375292026040', '+375292520200', '+375292803369', '+375295611110', '+375297156060', '+375298356974', '+375298358795', '+375298411741', '+375298485808', '+375333306428', '+375333518810', '+375336303958', '+375339159909']",11-09-2025 22:58:05
3,картон купить,https://globeco.by,"Мы производим упаковку из гофрокартона для организаций Гродно, а также Гродненской области с 2004 года. 125*125*125 (мм). Белый, без печати. микрогофрокартон ...",google,999,['jsc.glob.eco@gmail.com'],[],11-09-2025 22:58:05
3,картон купить,https://emall.by,"Наборы цветной бумаги и картона для творчества и рукоделия купить в интернет-магазине Емолл. Также картон для создания поделок, открыток и других изделий.",google,999,"['info@emall.by', 'obr@emall.by']","['+375172702914', '+375172703375', '+375291066358']",11-09-2025 22:58:05
