user_id,query,region,domain,description,engine,emails,phones,dateOfSearch
3,этикетки купить,149,https://shop-belblank.by,,yandex,"['022103@belblank.by', '022104@belblank.by', '022107@belblank.by', '022108@belblank.by', '022111@belblank.by', '022112@belblank.by', '022114@belblank.by', '022115@belblank.by', '022116@belblank.by', '022117@belblank.by', '022150@belblank.by', '022151@belblank.by', '022153@belblank.by', '022154@belblank.by', '022155@belblank.by', '022156@belblank.by', '022157@belblank.by', '022159@belblank.by', '022202@belblank.by', '022203@belblank.by', '022204@belblank.by', '022205@belblank.by', '022206@belblank.by', '022207@belblank.by', '022209@belblank.by', '022213@belblank.by', '022214@belblank.by', '022217@belblank.by', '022218@belblank.by', '022232@belblank.by', '022233@belblank.by', '022251@belblank.by', '022271@belblank.by', '022303@belblank.by', '022304@belblank.by', '022306@belblank.by', '022313@belblank.by', '022315@belblank.by', '022319@belblank.by', '022341@belblank.by', '022351@belblank.by', '022361@belblank.by', '022364@belblank.by', '022366@belblank.by', '022381@belblank.by', '022403@belblank.by', '022409@belblank.by', '022411@belblank.by', '022413@belblank.by', '022415@belblank.by', '022418@belblank.by', '022419@belblank.by', '022421@belblank.by', '022422@belblank.by', '022423@belblank.by', '022431@belblank.by', '022432@belblank.by', '022434@belblank.by', '022503@belblank.by', '022505@belblank.by', '022506@belblank.by', '022507@belblank.by', '022509@belblank.by', '022510@belblank.by', '022511@belblank.by', '022512@belblank.by', '022513@belblank.by', '022515@belblank.by', '022518@belblank.by', '022519@belblank.by', '022541@belblank.by', '022542@belblank.by', '022543@belblank.by', '022571@belblank.by', '022602@belblank.by', '022603@belblank.by', '022604@belblank.by', '022606@belblank.by', '022607@belblank.by', '022611@belblank.by', '022613@belblank.by', '022614@belblank.by', '022615@belblank.by', '022616@belblank.by', '022617@belblank.by', '022618@belblank.by', '022619@belblank.by', '022620@belblank.by', '022621@belblank.by', '022623@belblank.by', '022625@belblank.by', '022626@belblank.by', '022631@belblank.by', '022661@belblank.by', '022703@belblank.by', '022704@belblank.by', '022705@belblank.by', '022707@belblank.by', '022708@belblank.by', '022709@belblank.by', '022717@belblank.by', '022718@belblank.by', '022723@belblank.by', '022724@belblank.by', '022725@belblank.by', '022741@belblank.by', '022751@belblank.by', '022761@belblank.by', '022773@belblank.by', '022774@belblank.by', 'buy@belblanc.by', 'buy@shop-belblank.by', 'info@shop-belblank.by', 'perv.torg@minsk.gov.by']","['+375171345414', '+375172151465', '+375173006722', '+375445550568', '+375447737718']",01-10-2025 17:16:36
3,этикетки купить,149,https://shop-adara.by,,yandex,['info@adara.by'],"['+375173880180', '+375293994083', '+375447806670']",01-10-2025 17:16:36
3,этикетки купить,149,https://belalfaplus.by,"Информационная ценность: Самоклеящиеся этикетки позволяют передать важную информацию о продукте, такую как цена, состав, инструкции по использованию и другие детали. Они помогают покупателям принять осознанное решение о покупке и установить доверие к вашей компании.",yandex,['belalfaplus@gmail.com'],"['+375291410074', '+375291450038', '+375291450073']",01-10-2025 17:16:36
3,этикетки купить,149,https://yudway.by,,yandex,"['//office@yudway.by', 'office@yudway.by']","['+375173360462', '+375173360464', '+375173360465', '+375173360467', '+375296666489', '+375336666491', '+375336666492', '+375336666497']",01-10-2025 17:16:36
3,этикетки купить,149,https://ksen-ri.by,"Мы предлагаем купить самоклеящиеся этикетки от компании Emerson, подходящие для использования в струйных, лазерных и матричных принтерах. Они размещаются на листах формата А4, всего таких листов в одной пачке находится 100 штук.",yandex,"['bakushev@ksen-ri.by', 'druk@ksen-ri.by', 'gb@ksen-ri.by', 'info@ksen-ri.by', 'magazin@ksen-ri.by', 'shtamp@ksen-ri.by', 'zakaz@ksen-ri.by']","['+375172072347', '+375172174205', '+375172523553', '+375172703553', '+375173503553', '+375173970764', '+375173972257', '+375173977553', '+375291805350', '+375293355331', '+375295564360', '+375295622254', '+375296657553', '+375447171271', '+79999999999']",01-10-2025 17:16:36
3,этикетки купить,149,https://vial.by,"Самоклеящиеся этикетки - это расходный материал, который используется для маркировки товаров и продуктов.",yandex,"['brest@vial.by', 'ecr@ecr.by', 'gomel@vial.by', 'grodno@vial.by', 'info@vial.by', 'mogilev@vial.by', 'vitebsk@vial.by']","['+31536000000', '+375152603000', '+375162230888', '+375162231888', '+375173434346', '+375173880134', '+375212609609', '+375222733337', '+375232340000', '+375293810134', '+375295105555', '+375295555439', '+375295755557', '+375298888325', '+375298888675', '+375298888965', '+375333333016', '+375333333018', '+375333333019', '+375333333350', '+375333333358']",01-10-2025 17:16:36
3,этикетки купить,149,https://100etiketok.by,"Компания ""100 Этикеток"" предлагает Вам этикетки самоклеящиеся, этикет-пистолеты, этикет-ленту, термотрансферную ленту, чековую ленту.",yandex,['100etiketok@gmail.com'],['+375447572271'],01-10-2025 17:16:36
3,этикетки купить,149,https://bumcom.by,"Этикетки самоклеящиеся в листах Изделие выпускают в форматах A2, A3, A3+, A4. Листы А4 и А3 делают с насечками для лёгкого снятия этикеток с основы. Встречаются различные формы наклеек: прямоугольные, круглые, овальные, квадратные.",yandex,['info@bumcom.by'],"['+375173882045', '+375173882046', '+375175423211', '+375293609991', '+375297620808', '+375447620808']",01-10-2025 17:16:36
3,этикетки купить,149,https://pandaprint.by,"Купить наклейки, этикетки в Минске по низким ценам в каталоге интернет-магазина упаковочных материалов PandaPrint.by с доставкой по Беларуси. Оптом и в розницу.",yandex,['6055969@mail.ru'],"['+375173222207', '+375291207722', '+375291250077', '+375297122267', '+375445972207']",01-10-2025 17:16:36
3,этикетки купить,149,https://redpack.by,"В ООО «ВЭМАКС ГРУПП» Вы можете быстро купить самоклеящиеся этикетки в Минске. В нашем каталоге представлены востребованные варианты наклеек, что позволяет клиентам в одном заказе закрыть все потребности по маркировке.",yandex,"['info.gomel@redpack.by', 'info@redpack.by']","['+375291072727', '+375291076565']",01-10-2025 17:16:36
3,этикетки купить,149,https://upakovki.by,"Преимущества ООО «Лебрас Маркет» при покупке самоклеющихся этикеток. Широкий выбор: в нашем ассортименте представлены самоклеящиеся этикетки разных размеров, форм, материалов и цветов. Высокое качество: мы используем только сертифицированные материалы и современное оборудование.",yandex,['lebras@tut.by'],"['+375296426963', '+375296977375']",01-10-2025 17:16:36
3,этикетки купить,149,https://unimark.by,,yandex,['info@unimark.by'],"['+375172504545', '+375295583030', '+375445583030']",01-10-2025 17:16:36
3,этикетки купить,149,https://upak.by,,yandex,['zakaz@upak.by'],['+375293031072'],01-10-2025 17:16:36
3,этикетки купить,149,https://office.by,"Бумага для офисной техники Бумага для оргтехники, кассовых аппаратов Блоки для записей, закладки Тетради общие, полуобщие Блокноты, бизнес-тетради, алфавитки Ежедневники, планинги, органайзеры, календари Книги для записей, канцелярские книги Этикетки, этикет-лента и бумага самоклеящаяся Конверты и пакеты.",yandex,['info@office.by'],"['+31536000000', '+375173969636', '+375295555040', '+375295955559']",01-10-2025 17:16:36
3,этикетки купить,149,https://markit.by,,yandex,['beznal.markit.by@yandex.by'],"['+375173220307', '+375291331111', '+375292539923', '+375445843444']",01-10-2025 17:16:36
3,этикетки купить,149,https://gala-poly.by,Товар с такой этикеткой сразу захочется купить.,yandex,"['dasha@gala-poly.ru', 'diana@gala-poly.com', 'info@gala-poly.com', 'julia@gala-poly.com', 'olga@gala-poly.com', 'yulia@gala-poly.com']",['+375298285555'],01-10-2025 17:16:36
3,этикетки купить,149,https://partnerpack.by,"Этикетки широко используются в различных сферах, таких как продуктовая и розничная торговля, логистика, производство и многие другие. Они помогают упростить процессы управления складом, контроля качества и логистики, а также улучшить взаимодействие с потребителями. Если вы ищете место, где можно купить этикетки, то обратитесь в компанию ""ПартнерПак"".",yandex,"['hr@partnerpack.by', 'info@partnerpack.by', 'logist@partnerpack.by', 'marketing@partnerpack.by', 'snab@partnerpack.by']","['+375175016516', '+375291470783', '+375291483813', '+375293470783', '+375296470784', '+375333470783', '+375447035616', '+375447518081']",01-10-2025 17:16:36
3,этикетки купить,149,https://unipress.by,"Этикетки имеют матовую поверхность. Они подходят не только для этикет-пистолетов, но и для ручной маркировки. Наносить информацию можно любым пишущим предметом: чернографитным карандашом, шариковой или гелевой ручкой, фломастером, маркером.",yandex,['info.unipress@gmail.com'],"['+375172709030', '+375175127704', '+375291661794', '+375296101929', '+375333199030', '+375333942866', '+375445464858']",01-10-2025 17:16:36
3,этикетки купить,149,https://sezam.by,,yandex,['sezam1702@yandex.ru'],"['+375173553232', '+375173773232', '+375291032032', '+375296595343']",01-10-2025 17:16:36
3,этикетки купить,149,https://gsmpack.by,,yandex,"['evmenov@gsmpack.by', 'gsm_pack@tut.by', 'mail@gsmpack.by', 'rybak571@mail.ru', 'valera@gsmpack.by', 'vika@gsmpack.by']","['+375172878510', '+375172878515', '+375295172598', '+375296111058', '+375296240199', '+375297019069', '+375333884598']",01-10-2025 17:16:36
3,этикетки купить,149,https://thermalprints.by,"У нас вы можете заказать и приобрести и приобрести любой вид этикеток, термотоп, термоэко, полуглянец.",yandex,"['sales1@thermalprints.ru', 'sales2@thermalprints.by', 'sales3@thermalprints.ru', 'sales4@thermalprints.ru', 'sales@thermalprints.ru']","['+375173363000', '+375291828714', '+375295362667', '+375295779976', '+375297342219', '+375298510095', '+375298826621', '+375333004900', '+375333344449', '+375333344876', '+375333372752', '+375336821078', '+375336827180']",01-10-2025 17:16:36
3,этикетки купить,149,https://paperki.by,,yandex,"['paperki1@paperki.by', 'paperki2@paperki.by', 'paperki4@paperki.by', 'paperki5@paperki.by', 'paperki6@paperki.by', 'paperki7@paperki.by', 'paperki8@paperki.by']","['+375162576060', '+375292026040', '+375292520200', '+375292803369', '+375295611110', '+375297156060', '+375298356974', '+375298411741', '+375298485808', '+375333306428', '+375333518810', '+375336303958', '+375339159909', '+78162576060']",01-10-2025 17:16:36
3,этикетки купить,149,https://printex.by,"Изготовление самоклеящихся этикеток. Заказать этикетки на одежду с логотипом бренда предлагаем в типографии printex.by с доставкой по Минску, Гродно, Бресту, Гомелю, Могилеву, Бобруйску, Борисову, Пинску, Столбцам, Новополоцку, Орше, Осиповичам, Борисову, Молодечно и другим городах Беларуси.",yandex,['zakaz@printex.by'],"['+375173367336', '+375293527527', '+375333527527']",01-10-2025 17:16:36
3,этикетки купить,149,https://upakovan.by,Самоклеящиеся этикетки на листах формата А4 применяются для печати на непромышленных типах полиграфического оборудования и могут быть использованы при работе с офисными принтерами.,yandex,"['info@upakovan.by', 'pakkogroup@mail.ru']","['+375173964857', '+375291335773', '+375298154564']",01-10-2025 17:16:36
3,этикетки купить,149,https://iteraplast.by,Наша деятельность заключается в снабжении промышленных и торговых предприятий такими материалами как: Стретч пленка; Клейкая лента (скотч); Сопутствующие материалы. По желанию клиента мы изготавливаем на заказ фирменную клейкую ленту с логотипом предприятия.,yandex,['iteraplast@gmail.com'],"['+375222715151', '+375222746688', '+375222876688', '+375291090998']",01-10-2025 17:16:36
3,этикетки купить,149,https://ramok.by,"Мы сотрудничаем с юридическими и физическими лицами. Выбирайте позиции, количество, Для того, чтобы купить самоклеящиеся этикетки в рулонах, нужно отправить товар в корзину. Способ доставки: самовывоз. Склад компании «Рамок» находится в г. Минске.",yandex,['ramok@ramok.by'],"['+375172706700', '+375296102280', '+375296136700', '+375298552280', '+375333136700']",01-10-2025 17:16:36
3,этикетки купить,149,https://braga.by,Купить этикетки на бутылки вы можете на нашем сайте.,yandex,['bragaby@mail.ru'],"['+375296863200', '+375333209900']",01-10-2025 17:16:36
3,этикетки купить,149,https://uniflex.by,"Отправьте запрос, чтобы заказать самоклеящиеся этикетки для вашей продукции или получить полную и подробную консультацию от специалистов. Обязательно принимаются во внимание такие факторы, как материалы, особенности вашего макета, линиатура печати, специальные эксплуатационные требования к этикетке, необходимость персонализации этикетки уникальными цифровыми, QR или текстовыми кодами.",yandex,['info@uniflex.by'],"['+375175003900', '+375175003901']",01-10-2025 17:16:36
