user_id,query,region,domain,description,engine,emails,phones,dateOfSearch
3,производство колбас Москва,213,https://myasokombinaty.ru,Все мясокомбинаты Москвы и области с контактными данными на карте. Отзывы клиентов. Отраслевой портал Мясокомбинаты.ру.,yandex,['thematicportal@yandex.ru'],['+79999999999'],26-10-2025 18:29:30
3,производство колбас Москва,213,https://yp.ru,"Список колбасных цехов Москвы по производству и продаже колбасных изделий: телефоны поставщиков, часы работы, адреса, цены наколбасную продукцию.",yandex,['info@yp.ru'],[],26-10-2025 18:29:30
3,производство колбас Москва,213,https://meatinfo.ru,ООО «МЯСОПРОДУКТ» — российский производитель и поставщик мясных деликатесов и продуктов из мяса. Производство налажено в г. Москва. Изготавливаем: мясные деликатесы из говядины и свинины; колбаса в ассортименте; бастурма; деликатесы из мяса птицы (рулеты мясные с начинками); шпик (сало).,yandex,['sale@inline-ltd.ru'],['+78124253265'],26-10-2025 18:29:30
3,производство колбас Москва,213,https://kuskovomos.ru,"Торговый дом в Москве. 8 (495) 225-42-00. Заказать звонок. Москва, Рязанский проспект, 4А, территория АО «Кузьминское».",yandex,['info@kuskovomos.ru'],"['+74952254200', '+79999999999']",26-10-2025 18:29:30
3,производство колбас Москва,213,https://mikoyan.ru,"Официальный сайт Микояновского мясокомбината, лидера отечественной мясоперерабатывающей промышленности и производства колбас.",yandex,['mmkom@mmkom.ru'],['+74957856567'],26-10-2025 18:29:30
3,производство колбас Москва,213,https://tamp.ru,Производство колбасных изделий. +7 495 786 97 57.,yandex,"['info@tamp.ru', 'zakaz@tamp.ru']","['+74957869737', '+74957869757']",26-10-2025 18:29:30
3,производство колбас Москва,213,https://ompk.ru,Производство. В настоящий момент под торговой маркой «Останкино» выпускается более 100 наименований продукции с объемом производства 500 тонн в сутки... Далее. Компания. АО «Останкинский мясоперерабатывающий комбинат» (АО «ОМПК») - ведущий производитель продуктов мясопереработки и полуфабрикатов в центральной России.,yandex,['info@sosiska.ru'],['+74959805390'],26-10-2025 18:29:30
3,производство колбас Москва,213,https://moskvichmag.ru,"В этом году исполнилось 20 лет компании «Дымов». С самого начала появления на рынке «Дымов» позиционировал свою продукцию как премиальную. Даже запустил рекламную кампанию в Vogue. «Москвич Mag» съездил на производство посмотреть, как и из чего сегодня делают колбасу «Дымов». Начнем с того, что даже на оборонном предприятии не проводят такой строгий инструктаж по требованиям.",yandex,['info@moskvichmag.ru'],[],26-10-2025 18:29:30
3,производство колбас Москва,213,https://kolbasa-opt.ru,"Мясоперерабатывающее предприятие Мортадель специализируется на производстве колбасных изделий, полуфабрикатов, мясных деликатесов, кондитерских и хлебобулочных изделий.",yandex,"['5450732@yandex.ru', 'koskol63@yandex.ru']","['+74957730505', '+79857730505']",26-10-2025 18:29:30
3,производство колбас Москва,213,https://kolbasa.ru,Производство продукции и мясных изделий мясоперерабатывающим заводом «Мясницкий ряд».,yandex,['clientprav@kolbasa.ru'],"['+74959811719', '+79685344925', '+79854113341']",26-10-2025 18:29:30
3,производство колбас Москва,213,https://xn--e1aa2ahxea.xn--p1ai,"Таганский мясокомбинат — один из старейших не только в Москве, но и в отрасли, основан в 1928 году. Стратегическая линия развития завода — это производство высококачественной продукции класса Премиум из охлажденного мяса российского производства. Таганский мясокобинат —обладатель многих наград международных выставок, лидер в производстве колбасных изделий для школьного и дошкольного питания.",yandex,"['info@tamp.ru', 'referent@tamp.ru']",['+74957869757'],26-10-2025 18:29:30
3,производство колбас Москва,213,https://alekseevskie.com,Производство колбасы и колбасных изделий высшего сорта. Оптовые поставки колбасных изделий от производителя в Москве. О компании. Мясная продукция мясоперерабатывающего комплекса «Алексеевский» на рынке с 1998 года.,yandex,['alexkolbas@yandex.ru'],"['+74959886443', '+74959886483']",26-10-2025 18:29:30
3,производство колбас Москва,213,https://v-dymov.ru,"Москва. Начало производства сырокопченых колбас. С тех пор наши сырокопченые колбасы пользуются неизменным спросом, их любят за высочайшее качество, потрясающий вкус и разнообразие.",yandex,['info@v-dymov.ru'],['+78002000151'],26-10-2025 18:29:30
3,производство колбас Москва,213,https://sadkopremium.ru,"«Садко» — это производство с двадцатилетней историей, поставщик отборных мясных деликатесов, созданных по традиционным и авторским рецептам. Доставка вкусных и качественных мясных продуктов класса Премиум по Москве и России.",yandex,['sadko1@mail.ru'],"['+79319797036', '+79857239766']",26-10-2025 18:29:30
3,производство колбас Москва,213,https://melant-meat.ru,Официальный сайт мясоперерабатывающего завода. Колбасы оптом в Москве.,yandex,"['info@melantcompany.ru', 'quality@melantcompany.ru']",['+74952876065'],26-10-2025 18:29:30
3,производство колбас Москва,213,https://snezhanafood.ru,Колбасы. Варёные. Варёно-копчёные.,yandex,['snezhana@snezhanafood.ru'],['+74959885290'],26-10-2025 18:29:30
3,производство колбас Москва,213,https://kolbasny-mir.ru,Колбасный мир - официальный дистрибьютор колбасных и мясных изделий по оптовым ценам от производителей.,yandex,['mail@kolbasny-mir.ru'],"['+74952312412', '+74952312413']",26-10-2025 18:29:30
3,производство колбас Москва,213,https://avito.ru,"61 объявление об услугах по изготовление колбасы в Москве. На Авито вы можете заказать услуги изготовление колбасы и других специалистов по низким ценам. А также посмотреть отзывы и фотографии работ, договориться о цене и объеме услуг. Выбирайте среди предложений компаний и частных объявлений о изготовление колбасы на Авито.",yandex,['connect@avito.ru'],"['+74744410000', '+74952283630', '+77716588852', '+77753940159', '+77754672014', '+77763516562', '+77763841653', '+77774952376', '+77777182709', '+77777701640', '+77781255731', '+77781293090', '+77781334506', '+77781742342']",26-10-2025 18:29:30
3,производство колбас Москва,213,https://ochakovo.su,Залогом успешной работы нашего завода являются соединение передовых технологий с традициями колбасного «домашнего» производства.,yandex,"['info@ochakovo.su', 'ochakovo.meat@yandex.ru']","['+74957811151', '+74992721634', '+79035098097', '+79039607619', '+79163112727', '+79645938686']",26-10-2025 18:29:30
3,производство колбас Москва,213,https://products-opt.ru,"Колбаса и колбасные изделия оптом, мясные полуфабрикаты от мясокомбинатов Москвы.",yandex,"['5450732@mail.ru', 'koskol63@yandex.ru']",['+79636447117'],26-10-2025 18:29:30
3,производство колбас Москва,213,https://ruzcom.ru,"В каталог. Производство колбас, консервов и мясных деликатесов. Бутер.",yandex,['sekr@ruzcom.ru'],['+74955523227'],26-10-2025 18:29:30
3,производство колбас Москва,213,https://dymas.ru,Доставка колбас и мясных деликатесов в Москве и Московской области. В каталог.,yandex,['dikiivolk4545.8008@yandex.ru'],"['+79133027902', '+79617259227']",26-10-2025 18:29:30
3,производство колбас Москва,213,https://kolbasatandem.ru,Колбасное производство. в Ростовской области.,yandex,['kolbasa-tandem@mail.ru'],"['+73010152748', '+73517725044', '+74134422005', '+74231236493', '+74812133308', '+74843816702', '+74916688523', '+74949135286', '+77183171249', '+78573549072', '+79508449996']",26-10-2025 18:29:30
