user_id,query,region,domain,description,engine,emails,phones,dateOfSearch
3,проведение эвент мероприятий,149,https://sravni.ru,"Как организовать event. Организация любого мероприятия – это очень ответственное дело, где важно не упустить из виду не только основные моменты, но и многие детали. Ниже мы выделили 5 основных моментов, которые помогут вам в этом трудном, но интересном деле: Цель. Весь ивент строится на цели мероприятия, поэтому начинать нужно с этого.",yandex,"['815cbd8fbe4ae13496bfc96f4f36d84b@sentry.sravni-team.ru', 'legal@sravni.ru']","['+77710718303', '+78007073902', '+79250233848']",29-09-2025 14:16:25
3,проведение эвент мероприятий,149,https://unisender.com,"Виды event-мероприятий с примерами. Рекомендации, как организовать и провести событие.",yandex,['support@unisender.com'],"['+375173380509', '+74991135280', '+78005516822']",29-09-2025 14:16:25
3,проведение эвент мероприятий,149,https://alexgrim.ru,Как провести крутое event-мероприятие: советы по организации ивентов.,yandex,['zakaz@alexgrim.ru'],"['+74957215422', '+78005518931', '+79030100147', '+79037920486']",29-09-2025 14:16:25
3,проведение эвент мероприятий,149,https://mango-office.ru,"К таковым относятся, например, ивенты в виртуальной реальности и экофрендли-праздники. Из-за противоковидных мер компаниям и вовсе пришлось переосмыслить подход к организации подобного рода мероприятий. Рассказываем, что такое ивенты и почему бренды уделяют им столько внимания. Что такое ивент и зачем он нужен.",yandex,['bbdc5e71ebd94a278c4403cc34576da1@sentry.mango-office.ru'],"['+74955404444', '+74991104123', '+78005555522', '+79999999999']",29-09-2025 14:16:25
3,проведение эвент мероприятий,149,https://smart-estet.ru,"Особенности проведения event-мероприятия. Провести event-мероприятие сложно, но, при правильном подходе к делу, возможно.",yandex,['margo_victory@mail.ru'],"['+79033497171', '+79608561481']",29-09-2025 14:16:25
3,проведение эвент мероприятий,149,https://myfin.by,,yandex,"['editor@myfin.by', 'news@myfin.by', 'ok@myfin.by']","['+375172361384', '+375296261384']",29-09-2025 14:16:25
3,проведение эвент мероприятий,149,https://32may.pro,"Чтобы инвестиции в организацию мероприятия окупились, важно выбрать надежного партнера. Давайте разберемся, что такое ивент-агентство и как выбрать то, которое предложит качественные услуги по оптимальной цене: Прежде чем доверить организацию мероприятия, узнайте, как долго компания работает на рынке.",yandex,['info@32may.pro'],['+74950858088'],29-09-2025 14:16:25
3,проведение эвент мероприятий,149,https://newart.by,"Организация мероприятий «под ключ». Осуществляем все этапы организации, проведения и полного сопровождения мероприятия. Оригинальные концепции. Продумываем и создаем свежие идеи для каждого мероприятия и не используем шаблонных решений.",yandex,['info@newart.by'],"['+375172366161', '+375172366162', '+375293371335', '+375296950355']",29-09-2025 14:16:25
3,проведение эвент мероприятий,149,https://mmcatering.ru,"Зачем нужны event-мероприятия. Виды ивентов, их ключевые особенности.",yandex,"['inf@mmcatering.ru', 'zakaz@mmcatering.ru']",['+79770900831'],29-09-2025 14:16:25
3,проведение эвент мероприятий,149,https://bash.today,"""Эвент"" или ""ивент"" — как правильно говорить? Оба варианта употребляются в русском языке и считаются корректными. Однако в профессиональной event-сфере чаще используется термин «ивент». Это слово прочно закрепилось в лексиконе event-менеджеров, организаторов мероприятий и владельцев ивент-пространств. Event-сфера: структура индустрии событий.",yandex,"['838cd38ede32428583e1e1408c79c0f3@glitchtip.bash.today', 'a@bash.today']","['+74954097873', '+79705040880']",29-09-2025 14:16:25
3,проведение эвент мероприятий,149,https://wbooster.ru,"Этапы организации мероприятий. Роль персонала в организации мероприятия. Маркетинговая стратегия любого предприятия состоит из стандартного перечня инструментов, таких как реклама, PR, аналитика, исследование рынков.",yandex,['info@wbooster.ru'],['+74993902672'],29-09-2025 14:16:25
3,проведение эвент мероприятий,149,https://lovevent.by,,yandex,['lovevent.by@gmail.com'],['+375296093822'],29-09-2025 14:16:25
3,проведение эвент мероприятий,149,https://av55.ru,"Что такое ивент? Event (он же “ивент” или “эвент”) в переводе с английского языка и в широком смысле слова можно понимать как любое частное или публичное событие. Если же сужать параметры ивента, то сегодня к нему относят, в основном, мероприятия, которые организуют для действующих или потенциальных клиентов, коллег, партнеров. Чаще всего, мероприятие преследует цель проинформировать и привлечь внимание...",yandex,"['artists@av55.ru', 'info@av55.ru']","['+73452692326', '+73812664040', '+74951281029', '+78124247920']",29-09-2025 14:16:25
3,проведение эвент мероприятий,149,https://artista.by,"Event (праздничное) агентство в Минске. Профессиональная организация мероприятий под ключ: свадьбы, корпоративы, юбилеи, деловые события. Креатив, чёткость, результат.",yandex,['info@artista.by'],"['+375173003772', '+375291716599', '+375296822282']",29-09-2025 14:16:25
3,проведение эвент мероприятий,149,https://elvi.by,Промо-мероприятие в Минске Организация промо мероприятий Организовать презентацию нового продукта BTL мероприятия Промо Минск агентство.,yandex,"['605a7baede844d278b89dc95ae0a9123@sentry-next.wixpress.com', '8eb368c655b84e029ed79ad7a5c1718e@sentry.wixpress.com', 'info@elvi.by']",['+375293136060'],29-09-2025 14:16:25
3,проведение эвент мероприятий,149,https://skillbox.kz,Ивент-менеджмент — организация и проведение мероприятий. Мероприятия могут быть разными — от свадьбы до гонки «Формулы-1». Их организацией и проведением занимаются ивент-менеджеры. К ивент-менеджменту относится большое количество задач. Ивент-менеджеры контролируют все этапы подготовки и проведения мероприятия — от коммуникации с заказчиком до подведения итогов.,yandex,"['hello@skillbox.kz', 'mail@example.com']","['+77059565110', '+77475001236']",29-09-2025 14:16:25
3,проведение эвент мероприятий,149,https://firstarpromo.by,Организация EVENT мероприятий. Комплексные услуги по организации масштабного ивент мероприятия: от разработки концепции события до реализации проекта. Закажите услуги проведения мероприятия event маркетинга по самым выгодным условиям!,yandex,"['//sale@firstarpromo.by', 'job@firstarpromo.by', 'sale@firstarpromo.by']",['+375292833135'],29-09-2025 14:16:25
3,проведение эвент мероприятий,149,https://emotionevent.by,"Спасибо EMOTION EVENT за отличную организацию корпоративного мероприятия. Понравилось внимание к деталям, продуманная концепция и общий уровень подготовки. Отдельно хочу отметить артистов и атмосферу вечера. Были сложности с выбором площадки, но команда EMOTION EVENT предложила достойные варианты, и в итоге решение оказалось удачным. Гости остались довольны.",yandex,['emotionevent1@yandex.by'],"['+375256137246', '+375259063575']",29-09-2025 14:16:25
3,проведение эвент мероприятий,149,https://toras.events,,yandex,['torasevents@gmail.com'],"['+79253417076', '+79266592251']",29-09-2025 14:16:25
3,проведение эвент мероприятий,149,https://romi.center,"В русском языке существует несколько форм названия event-мероприятия: эвент или ивент. В переводе с английского слово означает событие, the event. Существует множество форм event-маркетинга, каждая из них нужна для решения конкретных задач. Занимается этим процессом event-менеджер. Это сотрудник или целая команда, ответственные за проведение мероприятия «от и до» — от выбора формата до приглашения спонсоров и...",yandex,['team@romi.center'],[],29-09-2025 14:16:25
3,проведение эвент мероприятий,149,https://easyevent.by,"За 10 лет работы мы получили большой опыт в организации мероприятий, который помогает нам создавать проекты различного уровня и масштаба. Команда Easy Event воплощает в жизнь самые смелые идеи, вдохновляет компании на рост и обновление.",yandex,['eventeasycreative@gmail.com'],"['+375297888439', '+375447995392']",29-09-2025 14:16:25
3,проведение эвент мероприятий,149,https://eventpark.by,"Деловые мероприятия. Организация и сопровождение конференций, выставок, BTL-мероприятий. HR-events. Организация внутрикорпоративного отдыха. MICE. Деловой туризм. Проведение корпоративных мероприятий.",yandex,['info_eventpark@mail.ru'],['+375299605220'],29-09-2025 14:16:25
3,проведение эвент мероприятий,149,https://catering-foodstream.ru,"Выбор места проведения. Разработка концепции. Подбор персонала и аудитории. Подготовка программы мероприятия. Ход мероприятия. Оценка результатов. Примеры успешных ивентов. Заключение. Организация мероприятий становится все более популярной в России, и с каждым годом количество ивентов только растет. Однако, мало кто знает, что ивент - это не просто вечеринка или сбор друзей.",yandex,['info@catering-foodstream.ru'],"['+74993017691', '+77710140679']",29-09-2025 14:16:25
3,проведение эвент мероприятий,149,https://eventologia.ru,Ивентология — все о продвижении и организации мероприятий (событий).,yandex,['info@eventologia.ru'],['+79014177503'],29-09-2025 14:16:25
3,проведение эвент мероприятий,149,https://eventer.by,"Мы глубоко погружаемся в ваш бренд и атмосферу, чтобы создать мероприятие, которое будет отражать вашу уникальность. Eventer.by не просто агентство, а партнер вашего бизнеса в создании незабываемых моментов.",yandex,['info.eventer.by@gmail.com'],['+375339957067'],29-09-2025 14:16:25
3,проведение эвент мероприятий,149,https://btl-me.ru,"Что такое Event мероприятие? Как часто вы бывали на мероприятиях, организованных брендами? Осознанно или нет, все люди становились участниками ивентов. Вы могли посетить спортивное событие, организованное производителем спортивного питания. Или случайно заставали показ мод в торговом центре, который проводят аккурат рядом с брендовым магазином.",yandex,['client@btl-me.ru'],"['+74996537261', '+79362355866']",29-09-2025 14:16:25
3,проведение эвент мероприятий,149,https://zaochnik-com.com,"Виды маркетинговых event мероприятий: Праздничные мероприятия — это эмоционально яркие события, несущие радость. Обычно их приурочивают к определенной дате (например, дню рождения компании). Такие события, как правило, предполагают бесплатные подарки участникам мероприятия и имеют праздничное оформление в виде воздушных шаров, фейерверков, украшений из цветов.",yandex,['info@zaochnik.com'],['+78003506973'],29-09-2025 14:16:25
3,проведение эвент мероприятий,149,https://doctorteam.ru,"Для каждого мероприятия устанавливаются конкретные цели, которых необходимо достичь при его проведении. Вид события выбирается в зависимости от его задач. Если нужны новые сотрудники, проводится выставка вакансий. Для ознакомления потенциальных и существующих клиентов с новым продуктом организовываются презентации. Каждый грамотно и профессионально проведенный эвент повышает ценность и значительность бренда.",yandex,"['#info@doctorteam.ru', 'info@doctorteam.ru', 'partners@doctorteam.ru']","['+74993408232', '+79295926662']",29-09-2025 14:16:25
3,проведение эвент мероприятий,149,https://toppromotion.by,"Event (ивент, ивэнт, эвент) – публичные мероприятия рекламного или развлекательного характера.",yandex,['hello@toppromotion.by'],['+375445418603'],29-09-2025 14:16:25
3,проведение эвент мероприятий,149,https://exiterra.ru,Эффективность маркетинговых мероприятий? Проведение event-мероприятий.,yandex,"['glavred@exiterra.ru', 'info@exiterra.ru']","['+74951086590', '+78001014372']",29-09-2025 14:16:25
3,проведение эвент мероприятий,149,https://eventdecor.by,С нами Ваше мероприятие оживает: мы создаём из концепции реальность. Оформление и техническое обеспечение мероприятий.,yandex,['eventdecor.by@gmail.com'],"['+375291202211', '+375293455499']",29-09-2025 14:16:25
3,проведение эвент мероприятий,149,https://eventum-premo.ru,"Проведение мероприятия Говоря просто, мероприятия, это то, что отличается от обычной жизни.",yandex,"['agent@eventum-premo.ru', 'go@eventum-premo.ru', 'office@eventum-premo.ru']","['+74957858446', '+79995555149']",29-09-2025 14:16:25
3,проведение эвент мероприятий,149,https://skillbox.com,"Планированием и проведением мероприятий занимаются ивент-менеджеры. Они работают: в штате компаний, которые проводят свои мероприятия; в ивент-агентствах, которые организуют мероприятия для клиентов; в местах проведения событий — например, в выставочных центрах. Ещё ивент-менеджер может работать на себя как фрилансер — организовывать корпоративы, свадьбы, дни рождения и другие события.",yandex,"['hello@skillbox.ru', 'u002ff80e9d2be5d74919bfb8210daed63e2f@sentry.wbd.skillbox.pro']","['+73432880104', '+73512009018', '+74952910742', '+74954016931', '+74954453639', '+74954453936', '+78006007847', '+78126025210', '+79310093246', '+79310093248', '+79310093249']",29-09-2025 14:16:25
3,проведение эвент мероприятий,149,https://vc.ru,"7. Организация и проведение мероприятия. На данном этапе осуществляется непосредственное выполнение плана и концепции мероприятия. Это включает организацию помещения, установку оборудования, проведение презентаций и выступлений, обеспечение потока участников, контроль логистики, проведение видео и фото-съёмок, взаимодействие с гостями.",yandex,"['deal@cmtt.ru', 'moderation@vc.ru', 'platform@cmtt.ru', 'sales@cmtt.ru', 'secret@vc.ru', 'support@vc.ru', 'u003edeal@cmtt.ru', 'u003emoderation@vc.ru', 'u003eplatform@cmtt.ru', 'u003esales@cmtt.ru', 'u003esecret@vc.ru', 'u003esupport@vc.ru']",[],29-09-2025 14:16:25
3,проведение эвент мероприятий,149,https://adpass.ru,"Каждое событие — это, с одной стороны, драйв, эмоции и синергия, а с другой — непрерывная кропотливая работа. Продуманная вторая сторона и создаёт магию ивента. Сегодня расскажем, как волшебники сервиса событий С4 готовят и реализуют мероприятия.",yandex,"['ariana.m@adpass.ru', 'd.semanenkova@adpass.ru', 'e.babakhanova@adpass.ru', 'l.zhidkova@adpass.ru', 'o.varava@adpass.ru', 'uliana.d-f@adpass.ru']","['+79685461836', '+79715262561']",29-09-2025 14:16:25
3,проведение эвент мероприятий,149,https://1btl.ru,1. Проведение эвентов что это? 2. Event мероприятия на конкретных примерах.,yandex,['info@1btl.ru'],"['+74957400598', '+78129938545']",29-09-2025 14:16:25
