user_id,query,region,domain,description,engine,emails,phones,dateOfSearch
3,поддоны купить оптом -site:wildberries.ru -site:ozon.ru -site:kufar.by -site:21vek.by -site:5element.by -site:masterdom.by -site:officeton.by -site:irecommend.ru -site:777555.by -site:dzen.ru -site:factories.by -site:equipnet.ru -site:sitmag.ru -site:rutube.ru -site:openbusiness.ru -site:emall.by -site:7745.by -site:auto.kufar.by,by,https://erwin.by,Лидер продаж! ... 9.92 р. ... Лидер продаж! ... 29.24 р. ... 43.18 р. Под заказ. Быстрый заказ. Показано ...,google,"['info@erwin.by', 'sale1@erwin.by', 'sale2@erwin.by']","['+375296555615', '+375296655601']",16-10-2025 01:55:22
3,поддоны купить оптом -site:wildberries.ru -site:ozon.ru -site:kufar.by -site:21vek.by -site:5element.by -site:masterdom.by -site:officeton.by -site:irecommend.ru -site:777555.by -site:dzen.ru -site:factories.by -site:equipnet.ru -site:sitmag.ru -site:rutube.ru -site:openbusiness.ru -site:emall.by -site:7745.by -site:auto.kufar.by,by,https://sanopt.by,"Купить оптом в Минске поддоны стальные, акриловые, чугунные по доступной цене. Официальный дилер. Доставка по РБ бесплатная.",google,['info@sanopt.by'],"['+375173800451', '+375291713377']",16-10-2025 01:55:22
3,поддоны купить оптом -site:wildberries.ru -site:ozon.ru -site:kufar.by -site:21vek.by -site:5element.by -site:masterdom.by -site:officeton.by -site:irecommend.ru -site:777555.by -site:dzen.ru -site:factories.by -site:equipnet.ru -site:sitmag.ru -site:rutube.ru -site:openbusiness.ru -site:emall.by -site:7745.by -site:auto.kufar.by,by,https://gidrolica.by,Купить пластиковые поддоны оптом и в розницу по низким ценам. Скидки на оптовые партии. Все товары сертифицированы.,google,['info@gidrolica.by'],"['+375175121320', '+375292737777']",16-10-2025 01:55:22
3,поддоны купить оптом -site:wildberries.ru -site:ozon.ru -site:kufar.by -site:21vek.by -site:5element.by -site:masterdom.by -site:officeton.by -site:irecommend.ru -site:777555.by -site:dzen.ru -site:factories.by -site:equipnet.ru -site:sitmag.ru -site:rutube.ru -site:openbusiness.ru -site:emall.by -site:7745.by -site:auto.kufar.by,by,https://fly-man.by,"Душевые поддоны Donatony - товары и услуги компании ""ООО «ФЛАЙ-МЭН»"": + ... 199 руб. У нас можно купить оптом и в розницу душевые поддоны Donatony ...",google,['info.fly.man@gmail.com'],"['+375173688391', '+375173959740', '+375292399740', '+375296659740']",16-10-2025 01:55:22
3,поддоны купить оптом -site:wildberries.ru -site:ozon.ru -site:kufar.by -site:21vek.by -site:5element.by -site:masterdom.by -site:officeton.by -site:irecommend.ru -site:777555.by -site:dzen.ru -site:factories.by -site:equipnet.ru -site:sitmag.ru -site:rutube.ru -site:openbusiness.ru -site:emall.by -site:7745.by -site:auto.kufar.by,by,https://santehnikaopt.by,Носит исключительно информационный характер и ни при каких условиях не является публичной офертой. Купить Поддон душевой из нержавеющей стали 90*90*115 оптом в ...,google,['santehopt77@mail.ru'],"['+375173633438', '+375173633439', '+375291020077', '+375293788834', '+375295088852', '+79303068881']",16-10-2025 01:55:22
3,поддоны купить оптом -site:wildberries.ru -site:ozon.ru -site:kufar.by -site:21vek.by -site:5element.by -site:masterdom.by -site:officeton.by -site:irecommend.ru -site:777555.by -site:dzen.ru -site:factories.by -site:equipnet.ru -site:sitmag.ru -site:rutube.ru -site:openbusiness.ru -site:emall.by -site:7745.by -site:auto.kufar.by,by,https://signas.by,Сифоны для душевых поддонов оптом по низким ценам от импортера. Только сертифицированная продукция. Доставка по Минску и РБ.,google,['911@signas.by'],"['+375172705424', '+375296298284', '+375447124295']",16-10-2025 01:55:22
3,поддоны купить оптом -site:wildberries.ru -site:ozon.ru -site:kufar.by -site:21vek.by -site:5element.by -site:masterdom.by -site:officeton.by -site:irecommend.ru -site:777555.by -site:dzen.ru -site:factories.by -site:equipnet.ru -site:sitmag.ru -site:rutube.ru -site:openbusiness.ru -site:emall.by -site:7745.by -site:auto.kufar.by,by,https://paltorg.by,"Купить поддоны/паллеты деревянные в Минске недорого и Минской области по низким ценам, оптом и в розницу, за наличный и безналичный расчёт.",google,['3999393@gmail.com'],['+375293999393'],16-10-2025 01:55:22
3,поддоны купить оптом -site:wildberries.ru -site:ozon.ru -site:kufar.by -site:21vek.by -site:5element.by -site:masterdom.by -site:officeton.by -site:irecommend.ru -site:777555.by -site:dzen.ru -site:factories.by -site:equipnet.ru -site:sitmag.ru -site:rutube.ru -site:openbusiness.ru -site:emall.by -site:7745.by -site:auto.kufar.by,by,https://ceglar.by,"Купить красный кирпич от 0,29 руб. за шт + Скидки! Оптом и в розницу с доставкой по всей Беларуси.",google,"['buh@ceglar.by', 'info@ceglar.by', 'kartashov@ceglar.by', 'kps@ceglar.by', 'omts@ceglar.by', 'sbut@ceglar.by', 'sgt@ceglar.by', 'ze@ceglar.by']","['+375176527368', '+375176527369', '+375176527370', '+375176527371', '+375176741430', '+375176741431', '+375176741435', '+375176741436', '+375176741442', '+375176741443', '+375176741447', '+375256898080', '+375296898080', '+375336684015', '+375336898080']",16-10-2025 01:55:22
3,поддоны купить оптом -site:wildberries.ru -site:ozon.ru -site:kufar.by -site:21vek.by -site:5element.by -site:masterdom.by -site:officeton.by -site:irecommend.ru -site:777555.by -site:dzen.ru -site:factories.by -site:equipnet.ru -site:sitmag.ru -site:rutube.ru -site:openbusiness.ru -site:emall.by -site:7745.by -site:auto.kufar.by,by,https://albaspa.by,Производство дислоцировано в Беларуси и отвечает всем европейским требованиям качества. У нас вы можете приобрести ванны в розницу или оптом напрямую от ...,google,['alba-spa@mail.ru'],"['+375293877777', '+375296335005']",16-10-2025 01:55:22
3,поддоны купить оптом -site:wildberries.ru -site:ozon.ru -site:kufar.by -site:21vek.by -site:5element.by -site:masterdom.by -site:officeton.by -site:irecommend.ru -site:777555.by -site:dzen.ru -site:factories.by -site:equipnet.ru -site:sitmag.ru -site:rutube.ru -site:openbusiness.ru -site:emall.by -site:7745.by -site:auto.kufar.by,by,https://www.ankirsplast.by,Приобрести качественные душевые поддоны оптом с доставкой по всей Беларуси – теперь это возможно с нашей компанией. Мы предоставляем широкий выбор по доступным ...,google,['ankirsplast@gmail.com'],"['+375173791051', '+375291070058', '+375291338812', '+375296845496']",16-10-2025 01:55:22
3,поддоны купить оптом -site:wildberries.ru -site:ozon.ru -site:kufar.by -site:21vek.by -site:5element.by -site:masterdom.by -site:officeton.by -site:irecommend.ru -site:777555.by -site:dzen.ru -site:factories.by -site:equipnet.ru -site:sitmag.ru -site:rutube.ru -site:openbusiness.ru -site:emall.by -site:7745.by -site:auto.kufar.by,by,https://0303.by,... покупку деревянных поддонов у нас еще более выгодной. Заказать поддоны в Могилеве оптом и розницу с доставкой. Если вы ищете надежного поставщика деревянных ...,google,['mail@0303.by'],['+375445880303'],16-10-2025 01:55:22
3,поддоны купить оптом -site:wildberries.ru -site:ozon.ru -site:kufar.by -site:21vek.by -site:5element.by -site:masterdom.by -site:officeton.by -site:irecommend.ru -site:777555.by -site:dzen.ru -site:factories.by -site:equipnet.ru -site:sitmag.ru -site:rutube.ru -site:openbusiness.ru -site:emall.by -site:7745.by -site:auto.kufar.by,by,https://baumarket.by,Поддон для душа Сантэкс стальной эмалированный 80х80 см купить в Минске. ➤ Оперативная доставка по Минску и всей Беларуси. Звоните ☎ +375 29 312 22 22!,google,['order@baumarket.by'],"['+375173881400', '+375255033333', '+375293122222', '+375295046846', '+375296661164', '+375333211111', '+375336333340']",16-10-2025 01:55:22
3,поддоны купить оптом -site:wildberries.ru -site:ozon.ru -site:kufar.by -site:21vek.by -site:5element.by -site:masterdom.by -site:officeton.by -site:irecommend.ru -site:777555.by -site:dzen.ru -site:factories.by -site:equipnet.ru -site:sitmag.ru -site:rutube.ru -site:openbusiness.ru -site:emall.by -site:7745.by -site:auto.kufar.by,by,https://severny.by,"12 сне 2023 г. ... Паллеты – удобные деревянные поддоны для размещения товаров, распространенные в современной логистике. Сегодня редко можно встретить склад ...",google,['severny.by@gmail.com'],[],16-10-2025 01:55:22
3,поддоны купить оптом -site:wildberries.ru -site:ozon.ru -site:kufar.by -site:21vek.by -site:5element.by -site:masterdom.by -site:officeton.by -site:irecommend.ru -site:777555.by -site:dzen.ru -site:factories.by -site:equipnet.ru -site:sitmag.ru -site:rutube.ru -site:openbusiness.ru -site:emall.by -site:7745.by -site:auto.kufar.by,by,https://damalin.by,"Продаем и покупаем деревянные поддоны. В наличии новые и б/у. Надёжность, честный объём, гибкие условия.",google,"['6513000@mail.ru', 'makksen2007@yandex.by', 'maks_karpenko_1994@mail.ru']","['+375295927726', '+375295939416', '+375297120012']",16-10-2025 01:55:22
3,поддоны купить оптом,149,https://palletby.by,"Мы покупаем деревянные поддоны различных типов и размеров для предприятий. При необходимости поддоны восстанавливаются, а затем сортируются в соответствии с требованиями заказчика.",yandex,['zakaz@palletby.by'],"['+375173995574', '+375293033326', '+375293077700']",16-10-2025 01:55:22
3,поддоны купить оптом,149,https://europoddon.by,Назначение деревянных поддонов и евро паллет – безопасная транспортировка различных грузов.,yandex,['palettyuk@mail.ru'],"['+375165641106', '+375296788786', '+375445003330']",16-10-2025 01:55:22
3,поддоны купить оптом,149,https://palletgrad.by,,yandex,['pallet_grad@mail.ru'],"['+375293776667', '+375296467218', '+375296567738', '+375445655214']",16-10-2025 01:55:22
3,поддоны купить оптом,149,https://poddon.by,"Используя бывшие в употреблении поддоны, Вы экономите до 40% по сравнению с покупкой новых паллетов, и, таким образом, уменьшаете накладные расходы своей компании.",yandex,['info@poddon.by'],"['+375173160040', '+375173160041', '+375293530033', '+375296363302', '+375296516363']",16-10-2025 01:55:22
3,поддоны купить оптом,149,https://b2b.trade,"Здесь вы можете купить паллеты, поддоны по оптовым ценам в Беларуси.",yandex,['hello@b2b.trade'],[],16-10-2025 01:55:22
3,поддоны купить оптом,149,https://agrobazar.ru,"Тут вы можете узнать, почём поддоны оптом в Республике Беларусь: гофроподдоны, европоддоны, деревянные, пластиковые, паллеты.",yandex,"['info@agrobazar.ru', 'xxx@mail.ru']",['+79100000000'],16-10-2025 01:55:22
3,поддоны купить оптом,149,https://forestbobrgrad.by,"Поддоны любой сложности, готовы изготавливать поддоны по чертежа заказчика. ООО «ФорестБобрГрад» располагает собственным производством деревянных поддонов. Используя современное оборудование, мы изготавливаем паллеты в строгом соответствии с требованиями заказчика.",yandex,['pohtal2009@mail.ru'],"['+375225706007', '+375296847271']",16-10-2025 01:55:22
3,поддоны купить оптом,149,https://poddoni.by,"Покупка поддонов (паллет). Цены на паллеты зависят от их конструкции и степени износа. Мы с одинаковой готовностью покупаем как целые, так и сломанные паллеты всех стандартных видов и размеров (1,2х0,8 м, 1,2х1,0 м, 1,2х1,2 м).",yandex,['9273133@mail.ru'],['+375447573133'],16-10-2025 01:55:22
3,поддоны купить оптом,149,https://pallet.by,"Поддоны(паллеты) деревянные, европоддоны(EURO, EUR/EPAL, евро поддоны) - современный вид транспортной тары, используемый для перемещения и хранения товаров. ООО«БЕЛВТОРПАЛЛЕТРЕСУРС» - может Вам предложить лучшие цены на поддоны которые вы сможете купить в Беларуси, Минске, Бресте, Витебске, Гомеле, Гродно, Могилеве.",yandex,['info@pallet.by'],"['+375293124555', '+375296877317']",16-10-2025 01:55:22
3,поддоны купить оптом,149,https://poddonopt.by,"Продать поддоны - скупка поддонов по всей Беларуси. Купить поддоны 1200х800, европоддон ...",yandex,['poddon-optby@ya.ru'],"['+375296572843', '+375296576889']",16-10-2025 01:55:22
3,поддоны купить оптом,149,https://partnerpack.by,"Купить деревянные поддоны можно не только для задач организации, но и для частного использования.",yandex,"['hr@partnerpack.by', 'info@partnerpack.by', 'logist@partnerpack.by', 'marketing@partnerpack.by', 'snab@partnerpack.by']","['+375175016516', '+375291470783', '+375291483813', '+375293470783', '+375296470784', '+375333470783', '+375447035616', '+375447518081']",16-10-2025 01:55:22
3,поддоны купить оптом,149,https://poddony.by,"Мы покупаем поддоны и европаллеты по максимальной цене, предлагаем различные варианты взаиморасчетов и обмена поддонов разных категорий.",yandex,['monteinvest@mail.ru'],"['+375173990805', '+375293424564']",16-10-2025 01:55:22
3,поддоны купить оптом,149,https://rufbel.com,отдел продаж.,yandex,['info@rufbel.com'],['+375298448447'],16-10-2025 01:55:22
3,поддоны купить оптом,149,https://pallettrader.by,"Купить деревянные поддоны у нас можно 24/7 без выходных, включая праздники.",yandex,['pallettrader.by@mail.ru'],"['+375296657880', '+375296698458']",16-10-2025 01:55:22
3,поддоны купить оптом,149,https://lindeksport.by,,yandex,"['lindeksport@tut.by', 'mgranules@yandex.by']","['+375293424267', '+375296578655', '+375296655172']",16-10-2025 01:55:22
3,поддоны купить оптом,149,https://monteinvest.by,Компания «МонтеИнвест» предлагает своим клиентам в Беларуси и Минске деревянные новые и б/у поддоны оптом и в розницу на выгодных условиях.,yandex,['monteinvest@mail.ru'],"['+375173992838', '+375296181093', '+375445181090']",16-10-2025 01:55:22
3,поддоны купить оптом,149,https://neftehim.by,,yandex,['neftesorb@xmail.ru'],"['+375173999797', '+375293777736', '+375293999797', '+73810537391', '+73810598180']",16-10-2025 01:55:22
3,поддоны купить оптом,149,https://xn----7sbabhi2atb2biu3ak.xn--90ais,Хотите купить поддоны оптом в Минске для транспортировки или хранения?,yandex,['upakovka.gruza@mail.ru'],"['+375336048417', '+375447553322']",16-10-2025 01:55:22
3,поддоны купить оптом,149,https://lambermil.by,"Изготовление деревянных поддонов, паллет. Продажа на экспорт и по Беларуси.",yandex,"['lambermil.by@gmail.com', 'lambermil@inbox.ru']","['+375163644448', '+375296431314', '+375298038285']",16-10-2025 01:55:22
3,поддоны купить оптом,149,https://palletbel.by,"­ Купить продать поддоны, паллеты в РБ +375 29 628 93 35.",yandex,['pallet2009@yandex.by'],['+375296289335'],16-10-2025 01:55:22
3,поддоны купить оптом,149,https://belpallet.by,"Преимущества новых, сухих поддонов. Хранение паллет без потери их качества: нет синевы и плесени.",yandex,['specwoodtrans@mail.ru'],['+375296403403'],16-10-2025 01:55:22
3,поддоны купить оптом,149,https://lumber.by,Производство поддонов по лицензии EPAL. Доставляем европоддоны по всему миру. Отгружаем поддоны 7 дней в неделю.,yandex,['lumber@lumber.by'],"['+375162559819', '+375295927782']",16-10-2025 01:55:22
3,поддоны купить оптом,149,https://poddonpallet.by,"Продажа новых и БУ поддонов, паллет по всей Беларуси.",yandex,['poddonpallet11@gmail.com'],"['+375296421360', '+375298881022']",16-10-2025 01:55:22
3,поддоны купить оптом,149,https://aist-srub.by,"Компания «Аист-сруб» предлагает купить деревянные поддоны и паллеты любых размеров и видов. Данные изделия будут актуальны для разных отраслей: сельское хозяйство, пищевая промышленность, производство, логистика.",yandex,['info@aist-srub.by'],['+375293163230'],16-10-2025 01:55:22
3,поддоны купить оптом,149,https://bimaplast.by,,yandex,['info@bimaplast.by'],"['+375172753428', '+375173701702', '+375177478837', '+375296830677', '+375296888838', '+375447548403']",16-10-2025 01:55:22
3,поддоны купить оптом,149,https://poddon-pallet.by,"Компания ЧТУП «Лес центральный» - торговая марка ""Паллет Ярд"" - производитель и поставщик поддонов в широком ассортименте В линейку поддонов входят разнообразные по виду, качеству, размерам изделия. Компания имеет свое производство для изготовления поддонов по европейским стандартам, соответствующим ГОСТ 9557-87, размером 1200х800, грузоподъемностью 1000 – 2500 кГ.",yandex,['info@poddon-pallet.by'],"['+375291505999', '+375293661777']",16-10-2025 01:55:22
3,поддоны купить оптом,149,https://poddontut.by,"Мы покупаем поддоны и европаллеты по максимальной цене, предлагаем различные варианты взаиморасчетов и обмена поддонов разных категорий.",yandex,['support@poddontut.by'],['+375291336031'],16-10-2025 01:55:22
3,поддоны купить оптом,149,https://abraziv.by,,yandex,"['alevtina@abraziv.by', 'anohin@abraziv.by', 'auto@abraziv.by', 'borelo@abraziv.by', 'buh@abraziv.by', 'color@abraziv.by', 'colorls@abraziv.by', 'hr@abraziv.by', 'liv@abraziv.by', 'logist@abraziv.by', 'lolita@abraziv.by', 'maksura@abraziv.by', 'mironchik@abraziv.by', 'pa@abraziv.by', 'parmon@abraziv.by', 'plutinskaya@abraziv.by', 'pravo@abraziv.by', 'retail@abraziv.by', 'rubanenko@abraziv.by', 'selivonuk@abraziv.by', 'site@abraziv.by', 'sk@abraziv.by', 'sklad@abraziv.by', 'sn@abraziv.by', 'sobol@abraziv.by', 'zakaz@abraziv.by', 'zakupka1@abraziv.by', 'zakupka2@abraziv.by', 'zakupka@abraziv.by']","['+375172413333', '+375172716666', '+375172726666', '+375173384444', '+375173386666', '+375291091285', '+375291122013', '+375291122031', '+375291123013', '+375291202013', '+375291221311', '+375291492002', '+375291985408', '+375293572002', '+375293853365', '+375296222932', '+375296323625', '+375296362336', '+375296852165', '+375296886550', '+375441122013', '+375445112191', '+375447183984', '+375447412799']",16-10-2025 01:55:22
3,поддоны купить оптом,149,https://realpack.by,,yandex,"['mail@realpack.by', 'pavel@realpack.by', 'trade@realpack.by']","['+375293702569', '+375296112569', '+375297087080']",16-10-2025 01:55:22
3,поддоны купить оптом,149,https://poddonvse.by,Производство и продажа качественных деревянных поддонов.,yandex,['diksan99@mail.ru'],"['+375296025253', '+375296645798']",16-10-2025 01:55:22
3,поддоны купить оптом,149,https://opengroup.net,"Поставляем деревянные поддоны точно в срок и в любом количестве. Незаменимая тара для погрузочно-разгрузочных работ и транспортировки должна быть прочной, экономичной и износостойкой – именно такие поддоны вы можете купить в OPEN group. Изготавливаем паллеты для производственных и логистических компаний в Москве и по всей России.",yandex,"['info@pallet.ru', 'zakaz1@pallet.ru']","['+78005337780', '+78005517520', '+78006003330']",16-10-2025 01:55:22
3,поддоны купить оптом,149,https://ruspallet.com,Покупка поддонов у производителя — это гарантия выгодных условий и бесперебойного снабжения вашей компании.,yandex,['info@ruspallet.com'],"['+78047005777', '+79056723636', '+79056758077', '+79056793200', '+79066034600', '+79092000598', '+79092002775', '+79092027989', '+79202019343', '+79202077040', '+79205550135', '+79295004344', '+79613313566', '+79623073046']",16-10-2025 01:55:22
